x,y
love flavor tuna easi healthi protein pack snack throw sandwich cracker eat salad homemad poke bowl favorit snack go perfect hike camp flavor chicken sea tub like flavor bumblebe pouch slightli cheaper still delici option curiou tri starkist pouch love varieti pack could tri sever flavor flavor textur pouch big letdown eat competitor product starkist version mushier tast fishier ad flavor artifici tast unlik chicken sea bumblebe pouch come utensil small thing good know still solid protein rich snack go especi find great price would much much rather brand version,3
best snacki snack,5
love pouch easi conveni excel product great tast bargain starkist excel brand reccomend,5
eat one,5
love,5
know season tuna pouch smell littl funni even though fresh flavor littl put think purchas stick fresh tuna can,3
great use salad make detox cleans five month wonder chang,5
box contain,1
product reason price andpackag easi elderli mother open,5
tasti fishi treat word may illeg inappropri use conjunct sentenc english languag bring packet lunch guarante cowork bother nag attempt approach rest day great deal high qualiti product chicago sang wrote tomorrow come regret thing said today signific like regret ate,5
love perfect job diet requir definit gonna get,4
product great except miss pack tuna box,5
tast great good snack crave eat someth fill smoki flavor actual satisfi unlik eat plain tuna calori carb stapl diet,5
nice packag good fresh,4
great account,5
got varieti pack want tri glad terribl portion also small actual mind meant eat less obvious repurchas,2
favorit flavor receiv sent box lunch go packet,2
good snack picnic okay qualiti,2
love,5
tuna best hickori smoke best flavor salmon chicken okay great,5
lemon one gross rest good,5
good size salad test frensh good good,5
starkist tuna creation honey bbq ounc excel choic awesom tast price lower store,5
gift,5
tast like crap,1
bought groceri store aw post review warn sweet spici plain yucki one bite toss trash,1
product great full hickori flavor great portion size snack small meal road,5
realli tast beacon,3
fresh tuna tangi,4
great lent,5
sure peopl like stuff howev cat ate smell like cat food yuk,1
flavor made rethink tuna decid give tri discov new delici flavor,5
love delici great valu,5
might grossest thing ever eaten sinc childhood choic clearli babi boomer gener us well get felt like eat cat food,1
happi tuna creation deliveri fresh product fast deliveri amazon ty,5
good purchas great portion control sandwich salad complaint box packag look thrown box pleas look product good,5
good qualiti,5
often eat lunch easi packag flavor tast except ranch make great snack go easi open packag fairli healthi easi store last origin packag without refriger till ye,3
dri need lot extra mayo pickl relish mix make passabl tuna salad sandwich,2
real smoke tuna tast know,2
ranch favorit love herd garlic,5
tuna good idea person pre mix make better,5
well sinc start diet work well,5
love tast great healthier snack go,5
r realli god great price,5
quick lunch jusi grab pouch open eat spoon sometim eat cracker lettuc tomato flavor varieti great favorit one lemon pepper,5
tuna flavor good,3
love,4
tuna ok realli tast ranch also come fork packag,2
like lemon flavor,3
eat lunch supper love sweet spici favorit,5
addict sweet spici tuna pouch,5
tuna fish good flavor iffi find bit strong,3
realli salti lemon overwhelm use eat tuna regularli keto imposs eat without ad lot thing dilut salti recommend,2
cant say enough good thing product conveni great calori content count calori simpl use lot good flavor tri,5
good edibl good,2
realli enjoy tuna packet go protein snack expens store glad buy bulk better price per unit reli store keep favorit sweet spici version stock,5
absolut like product like combin cottag chees yum,5
unlik tuna creation tast chemic weird smoke product tast nasti,3
everyth period tast aw nd product brand name purchas experi result tast aw safe say never,1
shipment great sweet n spici big,1
big fish fan tuna pouch good eat almost everi day,5
absolut tasteless tuna ever tri littl tuna tuna pure mush go back can,1
realli enjoy mix prepackag salad kit,5
oh god yuck yuck yuck bbq flavorless nasti lemon pepper cook rice ranch bleack threw last flavor away even go tri eat tast first,2
wateri product order,1
good varieti price,5
choic four packet tuna differ,4
love convin portion right,5
love tuna find need pop flavor found ad bit sweet pickl relish add right amount bright conveni grab pouch add bit relish tuna sandwich minut far price concern buy bulk amazon save money,5
great tast fast deliveri mix uncl ben insta rice realli quick easi snack,5
great flavor easi healthi snack,5
someon els order,1
absolut love conveni hurrican season south florida,5
best flavor okay best,3
realli enjoy right lunch cracker put spoon mayonnais right packag,5
good food scarc end month savior mani time love love love fiance,4
nice spici melt mouth spici right blend tuna heat definit order,5
ok quick lunch go flavor good realli like sweet spici,4
easi use,5
tasti,5
portion size freah okay flavor leav lot desir dri salti buy,3
lot flavor foil pack tuna tend go overboard spice flavor much tend mix plain chunk lite albacor tuna get ratio flavor knock strength smoke flavor right,5
handi tasti keep mind msg cant eat anymor due advers reaction ingredi good conveni way snack,4
like lemon flavor other put cracker crush bag make snack conveni go short bike ride kid stop park bench enjoy snack ride back home,4
like flavor extra protein flavor tast water would buy good deal,4
perfect quick lunch leav afternoon sleepi got much protein without carb sugar,5
wife love tast easi use packag breakfast lunch want quick meal box,5
delish make wanna buy,5
hickori smoke like taist nasti wont ever order sweet spici total nasti threw away hate wont ever order ranch ok lemon delici order box,3
great product,5
perfect snack go famili daughter son grab bit protein event,5
great valu gave chanc tri varieti flavor would buy,5
creativ old man live alon like make quick easi sandwich,4
eat lot tuna good flavor,4
wow flavor,5
pita soft tortilla make kind snadwich want great tast use straight packag condiment fish taco,5
good like local groceri better price,4
nice way eat healthi fish g protein g fat easi take along perfect sourc lean protein trim healthi mama eat plan tast great glad purchas,5
good portion person readi eat drain can tuna good camp great hurrican kit well need refriger open,5
need tablespoon miricl whip n sara lee wheat n honey bread sandwich delici,5
use knife cut four side get meat ok cat finish would work great camp,4
tast strang sour,2
flavor good portion size great snack,4
tast amaz mix avocado,4
item receiv quickli good expir date,5
knew good mom never imagin would bad figur worst could doctor mayb add chop onion littl mayo pepper well starkist readi eat tuna salad origin deli style doctor tip day tast horribl tuna past gloop glop whatev skip straight procur spring load diaper pin place nose enjoy horribl tuna past gloop glop get wrong die starvat may actual life sustain product make sure diaper pin handi,1
pretti standard like tuna seller ship apo oversea thank support deploy troop,5
like,5
much flavor small pouch love,5
final one packag tuna thing tast good flavor good utterli surpris rd tast first aw bumblebe thai chili tri starkist lemon pepper read one best one best super dri wonder wast plastic dri half tuna one juici beat juici pleasant look look slightli creami one best know tri tri one calori next like one mayb go back calori pack know sure less dri might although lemon dri garlic tend evok creami flavor could calori flavor profil experi tell sure,5
recent tri famili size starkist tuna creation must say good packet easi use tuna realli wonder flavor ingredi use seem fresh end result extrem tasti order quit item pleas good stuff,5
open packet bought yet ate lemon pepper time past realli enjoy like flavor conveni packag,5
easi tast great,5
yummi,4
great order great healthi snack,5
pack good mayb sandwich depend thick want sandwich arriv unopen undamag expir date year away open yet check back let know tast,5
updat bottom ranch sweet n spici hickori smoke want lemon pepper even come pack still buy hickori smoke heavenli ranch amaz updat day later hickori smoke best bought whole case flavor pack price excel star lemon pepper miss,4
hickori smoke great flavor low calori low carb get less packag good deal sesam ginger disgust amazon mess w review let post neg review click link ginger sesam hickori come tri go purchas page come item review tri review ginger sesam say someth unusu review activ must purchas product go ginger sesam page review flavor click review hickori come also put review differ flavor wrong list guess want sell ginger sesam peopl realiz horribl ginger sesam sharp like vinegar probabl much raw ginger red pepper sesam flavor horribl hickori smoke good sesam ginger bad,5
hand throughout pandem great flavor husband maker add dice oliv pickl tuna gener eat cracker toast bread purchas second case item hope eat much depend pandem long last thought would eat know still good thing hand,5
love product said hand receptionist hand anyon left porch,5
nice flavora bit salti,5
order sever time far alway fresh price fairli cost local groceri store flavor worth tri,5
strang mid aftertast tuna tast like sit pouch way long tast start turn,1
love perfect go meal make easi feel like cook,5
purchas count receiv one know thing happen find anoth way send messag regard issu,1
find flavor product besid tuna guess handi meal away home,3
probabl favorit flavor make great snack go,5
love best,5
use lettuc salad bread cracker rice cake sandwich prefer ranch version moist easier spread flavor choic great,5
origin suppos plain bought pack time amazon made right reorder got pack time right ad extra dice celeri heap spoon dill relish like homemad frequent lunch ritz cracker good stuff,5
alway keep packag tuna product home sinc excel altern quick easi lunch tast pretti good mix realli well green salad provid good amount protein,5
tast good,1
conveni quick easi use,5
order one tri realli like perfect sandwich think could even eat plain without bread would make handi less carb,5
must seal properli bc within coupl week bad packag come vacuum anymor tast smell rancid bought hickori smoke ranch one time fine alway check expir date packag food bought amazon disappoint,1
smell mous urin strong gave headach disgust,1
great flavor perfect salad sandwich,5
perfect singl portion amaz flavor good valu,5
mushi almost like mayonnais tuna soup flavor pretti one side toward tangi vinegar,2
actual order accid turn decent altern lunch less calori standard tuna pouch,5
love flavor much other wish pouch held tuna alway easi choic last minut snack,4
noth,5
tast great bought,5
lot flavor choos elimin need jar condiment handi often put ranch flavor saltin cracker littl piec chees one microwav short time nice portion size add salad use sandwich,5
tuna yummi great sandwich salad,3
eat time tast realli good go travel bring one last long time stay fresh thank,5
got emerg blackout requir refriger open easi store tast great cracker beat purchas store lunchabl get buck way,5
great lunch item snack,5
good packag solid,5
price good valu cost goe ill buy someon els,5
dislik fact box smash thank pouch okay great flavor fresh get lettuc make roll up pouch love brand tuna,4
great way protein lunch,5
like use product hike backpack lightweight packag littl tuna juic good anyway like tuna think lemon cut tuna flavor lot someon like fishi tast may find palat,5
conveni abl add whatev want make freash meal away home home way meal tast fresh get mushi,4
like tri differ flavor tuna decid flavor purchas,5
lemon pepper absolut best,5
tasti conveni,5
amaz eat selv rice yummi,5
look tast like cat food ranch flavor nasti never,1
usual take lunch alway tast good usual eat two portion littl small mayb depend,5
buy starkist tuna time bought singl serv pouch donat local pantri item need individu wrap easi perfect sourc protein realli good price,5
receiv packag fill maggot disgust,1
perfect size small sandwich add lettuc tomato stuff bigger sandwich eat plain coupl cracker love thank spici one littl hot,5
love everyth,5
great deal,5
price high better buy tuna store sprinkl lemon pepper singl pouch x price make sens buy use like buy good deal,1
interest stuff,5
foul strictli end time beat eat bug,1
fan one larg piec green red chili pepper tast ginger like would expect buy,1
tasti tuna salad great sandwich salad conveni use refriger need unless open littl pricey great conveni,5
use add tast varieti tuna salad sandwich,5
got pack isnt shabbi love flavor often go lunch low carb wrap fix,5
like flavor,1
tri flavor best far add cut veget perfect lunch noth wash offic sink great price subscrib save,5
realli tasti good sourc protein conveni portabl,5
small expens,5
love,5
tast better great way add protein frozen meal,5
great product conveni,5
great tast great price quick deliveri recommend compani,5
love conveni tuna pouch easi keep bag quick bite day love flavor except one straight tast like bile hard puke cowork like though gave win win,3
deli style tuna salad best portion size perfect sandwich add salad prefer packag select abl sandwich day save walk cane nearest store deli minut walk starkist tuna creation mani delici flavor tri,5
realli realli product advertis packet oz starkist tuna deli style per packet sell retail everywher instead sent one oz packet pleas send packet pleas send complet order return one packet one packet right amount one tuna sandwich good wait,5
tast great tini portion opinion,5
love quick snack especi work long hour add cracker set,5
product simpl like rest easi go put bag put lunch box easi use packag good,5
right size pack lunch tear open put bagel avacado top salad protein granddaught love make tuna fish sandwich safe open need option delici,5
tasti conveni,5
deli style tuna salad disgust tast,1
great quicki snack,5
toast multi grain bread put packag flavor want bit mayo could eat everi day use whole pack per sandwich,5
excel deal,4
make good snack wish portion larger,5
enjoy,5
good,4
love tuna tuna packet season love make tuna salad lunch,5
absolut love eat per day honey bbq fav flavor sweet spici realli realli conveni way add protein meal eat alon usual eat flavor alon ranch lemon pepper flavor good add salad buy,5
sandwich mix oliv oil mayo hickori flavor one tast like smoke salmon dad fish buddi use make black pepper love dad smoke salmon still freezer ye die year ago asthma emphasema attack turn halibut smoker,5
let start say love tuna go meal want someth light healthi high protein tri mani brand tuna pouch far worst tast one ever tast like spoil tuna juici dri past like textur worst part even return,1
rare eat lunch tuna pouch get late breakfast late dinner tasti satisfi gram protein calori neg get product pouch,5
purchas varieti pack flavor extrem help covid,5
old school tuna salad kid still sell far better flavor varieti tuna end use get sick dog take med lol work say total horribl good buy particular flavor,2
even tast like tuna took bite like nope tuna salad tast horribl nobodi home well eat portion small enough child sandwich adult,1
starkist tuna great opinion goe well mani dish like salad care smoke flavor great valu purchas,5
nice put salad cracker littl salti ish,5
like tuna packet quick meal simpl open prepar need though frequent add mustard season slice portion size good though bit less get typic tuna great meal go quick qualiti protein around home like alway keep around,5
left fish use,1
kid love,4
must tri everi singl flavor tuna excit tri ranch turn least favorit good,5
perfect portion size,5
famili favorit,5
love sampler know buy futur least favorit bbq flame unlik packag overwhelm tuna enough tuna packag sandwich add small salad flavor light add littl someth tone flavor tuna bit,5
low calori high protein neglig carb take camp take hike smear cracker bread rice cake good stuff,5
purchas item box twelv singl use pack open box pack fine look leakag whatev look perfectli normal open pack tuna pass eye inspect still insid pack scoop tuna place bowl smell whatsoev good bad put fair size tuna piec mouth instantli thank god start disgorg everi morsel extrem dark dark brown poison truli believ product tamper pouch seal sort qualiti control issu analysi product would dilig felt need share hope make potenti custom awar happen extrem care throw away fast pleas give anyon eat,1
troubl keep food medic issu tina fish thing bother perfect portion tast great,5
even though groceri store often stock starkist tuna pack often order amazon simpli good price fast deliveri deli tuna pack easi pull open make delici tuna sandwich keep hand time,5
flavor made sandwich,5
