x,y
perfect size good sandwich bit mustard perfect may also make good food earthquak kit,5
starkist tuna sandwich readi great quick desk lunch easi dinner famili price great ship free could want,5
lunch great perfect amount sandwich calori whole pouch bread add cours buy mine amazon though paid one pouch local wal mart buy real soon,5
great valu purchas famili save us money product love,5
tuna pouch right amount premad salad sandwich conveni stabl decent shelf life also nice howev suggest check ingredi list premad tuna salad make sure like person fan water chestnut mix quit like tast give one star review handi wish version littl simpler relish water chestnut,3
live dorm room still like take minut make sandwich take anywher think chunk light tast better albacor chunki,5
complet tuna salad noth add put bread lettuc make wonder sandwich enjoy much expect purchas,4
want add review far none review mention reason buy nearli year shelf life make fantast disast prepared use can tuna bug bag cours much lighter plastic bought dec label expir date sep like other said tast great ounc go fill hungri lightweight stick jacket backpack small enough squeez variou place pack protein nutrient fat make feel full wet enough make thirsti,5
fan flavor quit awhil add salad healthi meal larger size packet though difficult time finish went wast size perfect tri flavor sweet spici flavor provid extra zip plain tuna,5
love need market bettter discov costa rica delici better job market,5
great go big work need someth quick easi tast great would go,5
purchas friend know afghanistan much appreci packag content break depress meal serv troop draw,5
find packet easi use home motor home toast coupl slice bread made great sandwich meal,5
first thank vendor item actual size descript exactli mention tuna tast great deploy hate food serv,5
tuna salad tast good gooey consist far sweet fan tuna salad sandwich stuff make cut gave star still edibl enjoy,2
son look product groceri store could longer find tri amazon love bought,5
starkist arriv time excel condit right size lunch sinc find sweet spici store anymor work perfect deliv,5
perfect hand snack top salad great hand work quick lunch dinner buy,5
packag terribl case two store display pack came cut open bottom seal clear tape obviou product food stuff could easili tamper use product sorri sound paranoid realli day take chanc self favor order product would give starkist herb garlic five star favorit pack ship would give zero could,1
big fan tuna creation flavor gener ranch favorit take tupperwar spinach leav walnut dri fruit work open one badboy right eat dump top delici incred healthi could buy unflavor tuna inconveni fraction price ye will pay littl extra flavor conveni,5
price amazon less two buck unit rock picki eater need someth carri extend travel open one foil pouch expect much ad littl mayo good wow expect eat even travel,5
need someth quick easi meal work go colleg student good keep packag plastic fork car offic need healthi meal snack,5
need someth quick easi meal work go colleg student good keep packag plastic fork car offic need healthi meal snack,5
take offic add tomato pickl make fresh sandwich right amount tuna smoke tuna add flavor,5
carri work combin packet mayonnais make quick easi protein snack,5
titl review say absolut delici thing ever mouth flavor fresh tast perfect portabl packag bought entir case packag delciou last tast like someth would get fanci restaur make get daili protein easi like tuna love calori pouch dieter dream,5
like starkist tuna use buy can time one day shop found flavor tuna creation pouch curiou purchas three pouch hickori smoke herb garlic lemon pepper love pouch less messi get open squeez excess juic like lemon pepper like herb garlic tast intens hickori smoke absolut best sinc messi take work eat offic also found make recip casserol tast much better fan hickori make happi,5
love,5
great tast,5
reason thought small can pic show arent realli like product tasti great seller thank,4
great product price,5
great tast tuna easi grab work pouch much easier neater use can even pop top can reorder great flavor well,5
good thank lot regard,5
super quick deliv excel,5
excel,5
product expect like lunch go stuff mayo relish tuna kind crunchi onion realli like,1
one star ranch flavor lemon pepper good ranch disgust point worri get food poison expir base packet date hope get sick like ranch veggi thought might ok gross,1
cheaper groceri store great sourc protein,5
favorit thai flavor heat minut rice bowl cup open pouch pour tuna top delici lite meal,5
packag miss one pouch instead disappoint costli,1
want stop carri citi reason glad found,5
use quick meal,5
realli good add mayo eat straight pouch lunch great take offic compact high protein lunch,4
best tuna ever found amazon,5
giant per pack bonu card,5
outdat bad tast,1
great lunch snack right pouch tuna season full flavor add mayo want like plain also add salad skip dress,5
great product would definit recommend friend,5
tri eat healthier ad tuna fish diet list tuna fish get tast like well tuna fish thought would tri differ flavor good choic step ordinari tasti nutriti ask tri like,5
hard find store product new good price perfect packag perfect deliveri happi thank,5
keep hand quick dinner salad tuna nicois flash alway great sandwich,5
easi lunch tast great,5
dark tuna strong tast herb garlic flavor,1
good even need mayo make tuna salad,5
love flavor good product,5
best meal bag buy,5
delici,4
love,5
husband keto diet alway look low carb easi option take work eat straight pouch real effort stick plan great product,5
good product price,5
total addict ranch flavor absolut best calori hard beat eat time sometim bedtim snack weird know satisfi easi fix noth rip bag open low calori like even avid tuna fan promis enjoy,5
lot flavor lot like tuna water,3
love,5
great deal tuna eat tuna time day everi day,5
great tast,5
like except hickori flavor easi open good portion size lunch,4
keep appl purs time grab n go lunch snack run kid around help stay track lose weight busi schedul,5
like except ranch flavor thought disgust,4
love love love tuna flavor especi hickori smoke favorit husband take lunch crack salad flavor dress need love bulk amazon prime option make frequent purchas,5
love salad hard find local store reason,5
purchas elderli mom tast great straight pouch great idea meal time energi inclin make tuna salad scratch school snack,5
wrong tuna deliv receiv lemon crack pepper tuna happi hate lemon,1
fave flavor far love pouch conveni eat alon salad,5
love apprehens buy case tast flavor plain avail gave tri delici would probabl order even plain avail futur,5
delici fast prepar healthi pouch walmar disappoint amazon sell almost doubl price,4
hiker need someth simpli slap cracker lunch perfect use bu kit plain tuna mayo relish separ much simpler tast expect deli style light tuna white light tuna,5
conveni requir mayonnais definit would order packet come prefrain readi consumpt,4
delici super conveni,5
much need protein son love went jordan militari fail provid proper food littl pricey least provid way get food,5
good conveni,5
tast great healthi easi store open eat,5
excel beat tri find store,5
like tuna way packag hate risk get tuna smell hand usual trick squeez straight onto piec toast onto salad easi breezi recommend tuna salad want tuna fish sandwich mayo type deal tuna somewhat dri like lemon pepper though find easi way get extra protein day babi like,5
great snack go must,5
tast good tuna realli dri hard swallow,3
tast pretti good,4
flavor great fish tast dri better option,2
alway problem find enough shop abl get subscript great run stay focus eat price better market also love good refriger room temperatur,5
love tuna love fact come front door,5
tuna stapl especi colleg student practic live packag food normal wari buy food amazon price steal purchas four flavor individu groceri store exactli term qualiti shelf life soon expir packet eat tuna directli packag like flavor particularli sweet spici one lemon pepper hickori smoke flavor also seem season less two lighter less salti anoth note know peopl consid tuna dri lot less liquid typic can tuna would recommend buy one local groceri store make sure like moist dri tuna buy four,4
one better flavor especi eat buffalo flavor pouch right,5
perfect take lunch whole grain cracker add anyth good right pouch,5
love delici easi make sandwich good price less per packet groceri,5
best deal purchas packag week later hurrican matthew happen power day ate good tuna packag great surviv food,5
soo good great hand go day hour get hungri get,5
bought pack ranch favorit tast pretti good dg per pack outrag recommend go elsewher amazon lower price,4
mmm favorit tuna eat everi day lunch get cheaper subscrib buy groceri store,5
tast great,5
delici,5
love price good send subscript deliverei boy colleg run short protein,5
al littl bit lemoni pepper bit much happi unlimit suppli tuna sandwich great carri along snack hunt supplement anytim top salad dish cracker,5
tast great dri need oliv oil,3
buy send snack son work love fresh tast great arriv perfectli packag,5
yummi,5
love pack great toast bagel two,5
would order,5
hickori smoke favorit tast delici mix egg tomato salad,5
good packag sampl variou tuna creation,4
good deal like tuna conveni waterless packag,4
like tast tuna creation go say,1
best tuna ever could eat tuna everi day sinc come drain easi use pouch even better,5
nutritionist said eat mani love almost differ flavor bib think favorit,5
good conveni product keep work sandwich thin quick lunch also good salad brown rice tast reminisc old elementari school made lunch sandwich,5
fish salti season tast harsh textur resembl tuna broken chunk shown pictur packag bring travel emerg food sure local sanit condit need quick protein,2
delici fresh satisfi,5
real boon anyon work low carb lifestyl quick easi protein easi clean use make tuna salad dish spice make novel easi transport open dispos like flavor creation seri,5
product okay packag bit difficult open expens,3
perfect,5
love product,5
didnt like lemon pepper flavor,5
yummi,5
might like resembl tuna eaten can freshli smoke,1
good stuff,5
good well expect,5
good enjoy cat around tri eat lol,5
bit dri took one star,4
delici great valu,5
like pouch tuna hand ad protein snack eat directli pouch meal plain tuna healthi flavor pouch add bit tasti variat enjoy flavor varieti pack sometim good valu per pouch best deal local store chunk pouch tuna qualiti best tast good ideal snack sinc tuna still juic depend eat also find flavor work better salad sandwich eat pouch easi open individu flavor review hickori smoke somewhat sweet smoke flavor nice artifici flavor work great sandwich wrap pair well chees top mild sharp varieti also great plain green salad varieti juici drip sauc lemon pepper varieti combin somewhat artifici lemon flavor almost spici pepper kick lemon flavor quit intens find work salad great sinc like protein dress ranch tast like ranch dress mix tuna perfect balanc sweet savori herb juici moist flavor ideal sandwich especi warm bread sweet spici great flavor combo bell pepper sweet chili spici tomato onion garlic add flavor vinegar compliment everyth without overwhelm ad sugar would like delici treat,5
tast like tuna look like tuna smell like tuna,5
exactli order dd,5
delici varieti bit dri taken care bit mayonnais ad,4
littl fishi tast good,1
readi made tuna salad life,5
got part dorm care packag easi healthi snack,5
love,5
surpris much realli like tuna think sweet spici favorit honestli enjoy flavor packag easi throw lunch bag handbag pocket without worri leak flavor quit tasti right pouch mix bit mayonnais add pickl nut put salad bread recommend tri think enjoy conveni flavor,5
good conveni,5
alway keep work truck offic case need quick protein snack,5
yummi flavor great sourc protein great lunch snack,5
yum like conveni individu serv make two sandwich,5
skeptic flavor tuna packet love gram protein less calori relish pretti pepperi tast lemon like often eat water pack tuna plain realli like packet find coupon subscrib save pretti cheap continu buy awesom midday snack good,5
yummi conveni put pasta salad,4
love good,5
tasti product goe great cracker,5
great hiker food pack also pack small mayo pack mix trail though carri carri packag hike trail would nice recycl packag compon though realiz would challeng,5
littl tangi,4
eat tuna salad least time week lunch univers alway go larg quanit singl pouch come handi,5
bewar product shown starkist readi eat tuna salad count product receiv receiv starskist readi eat plain tuna count updat ultim replac item mix happen would given review realli good tuna salad could use littl bit mayo tast overal pretti good product,1
yummi great price arriv well packag,5
tuna high qualiti tast quit fishi flavor tast natur either think probabl full lot artifici stuff preserv realli affect flavor recommend,2
great small protein rich snack,5
take packet tuna salad us go rving make quick roadsid lunch stop make tuna salad sandwich slice bread open bag chip quick easi lunch rv fraction cost meal fast food restaur packet good carri day hike nation park open tuna packet eat directli plastic spoon eat ritz cracker easi lunch pack trash,5
tasti fill calori okay like tuna like,5
love packet lunch person favorit sweet spici flavor good eat cracker add salad price groceri store conveni order onlin easili come packag though need fork,5
like,5
good varieti flavor,5
hmmm realli want like low calori quick snack full protein smell tuna seem prolong feel everi person come contact smell ate eat eat peppermint someth realli like tuna realli care flavor varieti pack truli disappoint sinc would amaz choic sinc constantli watch eat,3
love hand lunch snack much conveni order larg pack,5
son deploy life saver,5
perfect broke colleg student tri save reduc amount time visit groceri store buy,5
good,4
tasti lunch snack,5
tast great pretti much dish,5
excel qualiti,5
best hike snack yet high protein tast good fit small pack way go starkist,5
get meal one pouch definit entir sandwich flake tuna like mush delici,2
gross got ask littl can told order gross,1
excel product year old poor health abl get around well product easi make sandwich eat right pouch mari kish tennesse,5
delici,5
make great snack go,4
make regular can tuna seem dull bore easi store delici eat smoke flavor chang whole concept tuna salad sandwich,5
bad,5
great snack,4
great tast like tuna like smoke meat daughter love perfect size packet,5
daughter roommat complet addict nyc lifestyl perfect stick backpack meal readi eat wherev,5
star,5
husband love quick heathi snack,5
flavor good qualiti good tast like came damn can appetit big littl pouch could eat three four next time order someth larger size,4
excel flavor price,5
packag keep get smaller first came amount reason bare minimum pouch ridicul like think notic packag get smaller price increas said flavor realli tasti like quit bit,3
conveni packag,5
expect,5
packag purchas pleas flavor keep desk work easi quick snack eat protein laden meal,5
tast like tuna damag packag,4
love found less expens local groceri store,3
excel product much expens purchas one packag tuna creation oz prefer buy bulk packag exceedingli diversifi product delici salad top mix mayonnais eat straight packag quick bite eat would buy singl packag bulk avail fair reason price,5
tast awesom,5
delici tri type tuna pouch flavor one definit one best aldi lemon pepper sweet spici also favorit class think creami dress consist like lightli dress tuna salad without ad celeri love big garden salad pasta black rice salad pea celeri tomato squeez lemon lime juic avocado toast frankli great pouch need hit protein go tast decad satisfi rel calori less dollar pouch also good valu,5
great tast tuna salad,5
great camp,5
good great tast,5
love conveni individu packag,5
tasti treat,5
harder harder find love,5
decent flavor sure origin tuna speak healthi product flavor alright protein good,4
delici even mix tuna season flaor,4
great keep desk work tri product mushi sweet much better good amount snack salad topper salt season balanc good sometim add sweet hot mustard,5
delici mix brown rice breakfast,5
wonder lunch perfect portion,5
favorit quick snack lunch work love varieti pack,5
like tuna like smoke meat stop read review order darn hickori smoke tuna poo fantast eat pack lunch everi day right pouch mmmmmm,5
delici howev realli lame get flavor varieti pack want flavor tri herb garlic,3
love tuna,4
good keep hand,4
love tuna easi good get great instant protein fix,5
wife love product,5
perfect make sandwich lunch noth els need bread enough need actual enough one sandwich realli good price,5
product wonder make sandwich great tast,5
product wonder make sandwich great tast,5
stuff good buy probabl get subscript,5
love tuna lemon pepper flavor favorit put salad sometim mix greek yogurt make healthier tuna mixtur also great go rip open packet chomp like flavor lot tradit tuna smell sinc lemon keep buy great,5
love tuna issu get anyth,5
problem delici,5
conveni,5
much liquid,2
portion good need add littl mayonnais,4
great take along nutriti snack cracker top salad sandwich,5
real handi ie cupboard,4
great pice use dog food make fur shine real treat pet get treat,5
love flavour except lemon pepper kind strong flavour,5
everyth product accur deliveri schedul pleas purchas plu daughter love share,5
still favorit flavor,5
great tast snack low price,5
realli like flavor great cracker top salad,5
describ,4
still bag made throw tri twice make sure tuna someth els two time sever week apart mayb like stomach,2
son love easi quick sandwich doctor,5
realli good perfect healthi addit meal one person buy husband night get home later usual tire feel like cook anyth alreadi made refriger night make veget mayb toast salad open one us healthi meal love partial hickori smoke husband like sever flavor includ mango one jalapeno one also like salmon creation,5
good,5
tasti conveni love take packet work chees cracker good,5
exactli want great price,5
love flavor easi use open place drain liquid perfect picnic throw bag lunch,5
love life saver workout,5
great select hurrican,5
great plain tuna mayo would tast better expect suppos honestli buy eat bread,3
great tast come recip light easi carri need open scissor hand lemon flavor favorit home away great conveni without sacrif tast,5
delici conveni pack protein sent right door great price could ask love,5
great along garlic herb flavor well eat go tear open pouch eat spoon,5
sweet spici flavor tuna past agre like flavor differ stroke differ folk guess,2
love tast lemon pepper tuna,5
surprisingli tasti spici other,5
great deal great price unfortun amazon sinc rais price,5
order got paid,3
care flavor sure peopl would like ok,4
well problem pack varieti possibl go like four experi least three four nice enjoy even think hey like conveni work travel camp whatev hickori smoke felt hideou enough longer even want think natur buy howev guess kind recommend get instead pack want buy someth find like know get hickori tast may differ get idea toy star word say like score say overal okay,3
ye ye ye look anoth flavor found hickori smoke packag quit unsatisfactori love stuff great work travel camp whatev whenev need someth tide last long time refriger need tast like expect tuna salad tast like part subscrib save line,5
like tuna salad tast packag squeez packag easili scrape good go lunch,4
excel product packag realli conveni portion eas open pack camp hike bag lunch pail take littl space kitchen cabinet prefer lemon pepper highest protein smallest calori use alfredo sauc stuff bell pepper love eat chees healthi cheap good food good snack great packag,5
purchas readi eat portabl easi use anywher special open utensil mind pouch meet expect issu starkist readi eat tuna salad tast bad delici realli like tuna eat plain littl salt happi go ingredi need complement enhanc tuna one reason chose product outsid portabl celeri water chestnut thought would bit crunch combin onion powder mustard flour also sound like would give tuna salad littl pep pretti flat say textur want non crunchi tuna salad nice egg yolk wet ingredi enough give tuna nice bodi spread mouth feel salad overli wet definit dri way shape form enough moist find need take product put anoth dish start ad thing bring would happi enough eat point feel worth would rather make tuna home way like find anoth portabl method go anoth food item togeth,3
kinda dri tuna,3
great pack lunch,5
yuck,2
luv,5
stay pantri lunch dinner,4
first skeptic open tuna instead usual want tuna sandwich without tri find addit ingredi open besid contain store leftov cat get quick addit salad tast subtl overpow faint heart use spici ingredi spici usual add sriracha,4
enjoy flavor year love,5
spici would buy,5
delici,5
nice varieti pack like flavor good sandwich salad,5
use hate packag fish smell aw tast bland like fish sauc sometim gourmet end use fri rice fish cake rice ball pre flavor packet good enough add sandwich mesh well ingredi make pretti nice fish base dish definit actual nice hand fish high protein low calori surpris use much end actual cook,4
great qualiti great price,5
love flavor tuna creation favorit easi carri school work tast great alon bread cracker salad,5
tasti conveni use tuna crab pot pie good,5
lot better qualiti expect tast fresh unlik store bought one,5
tuna salad awesom right pouch love whole wheat bread slice chees quick tasti sandwich hesit buy cracker snack pack tuna differ much better way better give tri,5
conveni outstand flavor,5
perfect serv size,5
awesom easi work lunch,5
gener love tuna howev except spent year armi wors mre ever ate consist goo except plain tuna everi flavor suck,1
famili love ranch hickori smoke fave,5
delici perfect go lunch good cracker,5
love packet wish came differ varieti like flavor come pack,5
bland,2
conveni tast,4
love flavor tuna packet give great kick tuna perfect throw backpack lunch bag like pack amazon avail local,5
nice tri flavor ranch best,5
daughter favorit lunch protein,5
much tuna money expect better flavor even tho conveni buy,2
spici eat two three packag tuna,2
brought partner snack pack worm sinc find heathier altern eat lovessss especi flavor,4
obvious purchas much know like,5
handi snack meal,5
great select tuna make sandwich tasti treat,5
fit well calori day diet take paper lunch bag write outsid calori day drop item bag store fridg sever time week drop bag satisfi tasti protein sourc calori buy differ varieti month favorit,5
made big commit bought pack upfront tast glad realli great conveni way use tuna make great tuna salad lot flavor also make tuna dip new stapl pantri,5
order enough deliv origin box stale date,5
eat one everyday work love one thing add dash button,5
mmmmmmmmmm tasti,5
qualiti good crazi flavor quit possibl care lemon pepper much anticip would though,3
per pack great deal good flavor buy,5
great tuna alreadi season readi eat grab pouch cracker enjoy,5
love perfect amount,5
pleas arriv time pack product,3
put low cal bread cal per two slice hot pepper bam got snappi meal,5
like except ranch flavor realli bad ranch flavor make turd though,3
easi alway good,5
good varieti go home,5
omega come much conveni littl mayo cracker delici,5
tasti without dryness sometim plagu even restaur prepar tuna salad love deli style impress flavor dri imho,5
way make tuna salad dark chunk tuna tast good easier,4
great lunch trip outdoor even long term food storag good tast extra touch lemon great pouch made salad alway keep box hous,4
favorit flavor local store alway run,5
salti first bite son go back store get sweet relish make edibl,3
great quick snack carri day,5
flavor great prefer plain,1
great packag littl weird open bottom,5
love convinc,5
love conveni tasti varieti pack love hickori smoke pack,5
flavor gross,2
tasti sinc requir refriger easi keep go,5
tuna creation good,5
love varieti good flavor,5
realiz within box tuna receiv herb garlic beyond return date,1
everyth alreadi made take pouch delici,5
eat tuna healthi daili stapl probabl better varieti versu order one flavor coffe varieti pack,4
kid hubbi love abl grab go packet perfect snack easi order use subscrib save healthier option fast food go continu purchas packet discount price,5
love flavor spici flavor like pouch hand enough one sandwich lunch cottag chees mix singl mac chees cup one person casserol hurri,5
nice littl bit salt,4
tri first boil potato salad dinner first time okay got pouch want protein diet thing day tri eat pouch lunch tast horribl,2
famili favorit best price find,5
order sweet spici tuna butreceiv regular tuna flavor,1
ok,5
surpris good mayb backpack mountain eaten littl guy great purchas next camp trip,5
enjoy varieti pack cheaper buy store,4
ranch flavor tast like tuna disappoint,2
yummi great price,5
tast great,4
great combin flavor flavor per price less buy alon nice varieti hand,5
almost good make littl crunch fine chop veggi much mayonnais calori count still good,4
issu,5
love best,5
tast great,5
great pack lunch keto meal prep wish bulk pack came assort,4
tast great carb easi eat straight packag great lunch snack,5
aw tast gone bad fish packag ined slime,1
adequ pinch take get use certainli conveni could psycholog tast littl artifici,3
usual get local big box store ran order although expir date tast fishi usual lead believ store extrem temperatur eaten far get sick note tast fresh usual get local store brand pack size flavor saw damag packag seam intact still product tast fenc order,3
great snack larg enough,5
take coupl day lunch great way get protein great flavor buy catch good price,5
perfect lunch,5
favorit snack,5
bad especi need quick low carb snack enough enough make dish kind,4
huge fan tuna tuna creation stuff amaz even right pouch,5
love snack add meal usual get migrain headach snack item one like way amazon fresh alway stock local walmart alway,5
