x,y
receiv happi came fast true order tri flavor yet price even like worth tri sure would love thought,5
panic begin big crisi order bunch well differ thing thought would easi partial disabl want fight crowd innoc littl packet four flavor enough sandwich small salad hickori flavor way world quick flavor mess,5
becom favorit sandwich spread,5
product starkist arriv soild condit time matter tast purshas item store definit enjoy tuna pouch fresh effortsless tast without use open,5
treat tuna pouch like can tuna mix mayo dri otherwis flavor noth moistur sure tast good wet,5
tri get friend mine tri convert yet know tast becom devot fan like hickori favorit come low sodium hickori promis stock price gain buy suppli,5
love tri new flavor great valu packag,5
love love product go wrong,5
easi open good flavor,5
good product,5
tri flavor like better great solut want quick protein go keep offic eat chanc go lunch would also great camp trip,3
great protein snack go keep offic case go good camp eat right bag lot often eat,5
bore can tuna thought tri pouch tast everi flavor love low calori give great protein supplement also conveni drain,5
receiv time manner product advertis,5
tast good,5
yummmmi snack veryyyyyy conveni definit advertis,5
tri product yet howev upon open found box alreadi open one packet miss sweet spici receiv chang star quick easi,5
littl pkg great go quick flavor taco wrap add dill pickl spear coleslaw good go,5
product suffici amount tuna enough flavor good tuna melt sandwich worthi money clean easi use,4
great backpack around quick snack good quick tuna sandwich hurri,5
salti,3
good,4
weird flavor love can tuna mani packag tuna snack odd tast someth ad throw almost citric acid tast realli high hope work snack say buy,2
understand review soo good refund price,1
flavor tuna hit famili donat local food pantri hope someon would enjoy,2
fave tuna flavor ever,5
great,5
product surprisingli good calori,5
realli enjoy tuna initi bought packet hickori smoke flavor love still recommend delici right amount flavor good experi hickori smoke flavor decid buy varieti pack excit tri flavor sadli regret purchas flavor simpli overwhelm imposs eat well manag choke ranch lemon pepper tast like grind pepper grinder directli tongu ick like subtl pepper flavor chomp hand raw pepper sweet spici certainli sweet good way tast like drink bottl sweet chili sauc sweet spici flavor whole thing tuna tasteless vessel ranch manag eat whole pack halfway felt overpow sour attempt eat straight packag might tast better part recip flavor way strong usual enjoy highli flavor dish continu buy hickori smoke flavor rest gross,3
lemon pepper tuna favorit prefer starkist tuna thank,5
standard tuna snack delici conveni somewhat healthi,5
nice varieti,5
great flavor,5
delici,5
like eat snack low sodium triscuit good backup pantri,5
love buy tuna fish pouch portion control enough perfect amount tuna sandwich readi eat buy price hope sale store,5
tasti delici need,5
tasti conveni,5
love buy time groceri store sinc get store time buy love flavor except hickori smoke one rest amaz,5
love product great flavor great price love varieti,5
sorri look tast like dog cat food tast side nasti look like peopl like tho,2
found varieti pack great valu highli recommend due tast brand name decent shelf life,5
awesom,5
great send deploy troop,5
tast probabl buy amount price could justifi gonna stick albacor water instead,2
star bc good noth new like made tuna salad whoop dee doo thought someth uniqu,4
order pack receiv pack came open box excess tape around cheat short pkg happi,1
great tast quick meal go,5
love product price good,5
ok around small portion,2
salti,2
ate snack like dri flavor blah,1
great quick snack meal,5
stardust tuna,5
one favorit flavor tuna fish buy ten groceri store found sell case happi circumst hit miss whether store stock extrem stoke amazon stock case total eat pouch make sandwich put salad love flavor hope never stop discontinu sweet spici good snack,5
tasti snack would buy,5
say conveni someon like varieti flavor favorit smoke tuna best flavor other much season,2
box beat pretti bad ship box actual box pouch,4
sinc pandem abl leisur stroll store much use get weekli tuna packet lunch work saw bulk item amazon flavor love purchas stuck eat sandwich love lemon tuna definit match,5
love tuna order,5
recent tri three flavor sampl bbq amaz classic bbq accident order honey bbq one work still fishi classic bbq mix relish crush cracker chip yum portion size small,1
trade found oili wateri could person tast love plain albacor,3
tast great yum,5
far favorit tuna creation make either salad lettuc wrap also eat plane high protien healthi snack meal also buy cheaper buy individu store,5
tast good gave conveni way tuna,5
wife ate one threw rest trash,1
easi take long day work great tast,5
love take backpack camp trip handi use light weight ad varieti flavor excel rank order would sweet spici lemon ranch hickori smoke wrap tortilla add mayo bingo tuna go perfect meal funguy,5
conveni,5
yummi,5
yummi,5
muy bueno gracia,5
like tuna salad mother use make answer would cours hand perfectli accept tast product make quick tasti sandwich add salad spread cracker snack decent amount protein compar low fat content heavi salt user salti tast review impli desir add dash salt pepper well extra mayo hard boil egg pump notch cours shelf stabl packag nice requir littl space store pantri cabinet best date leav plenti time use product less buck per packag time find fairli decent bargain well,5
tasti,4
great mix regular can tuna make better,2
love conveni flavor good kind bitter add thing need addit name tuna salad think bitter tomato mayb use green pepper like chicken salad,5
need flavor thought would tast like sweet n spici salmon wrong add thing make edibl hate wast anyth,3
terribl tast throw,1
love tuna tast great conveni stinki leftov deal fridg next day varieti good deli style tuna salad favorit,5
bought flavor sandwich good sprinkl salad stir noodl dish extra layer flavor quick complic meal,5
tast,5
bought mistak instead return figur would give tri like conveni product unfortun thought disgust flavor tuna self bad tast extrem tuna smell one could somewhat stand lemon alway brand definit never purchas,1
tuna pouch deli style best estim juici make delici sandwich plenti ad tomato lettuc delight tummi good tuna pouch good mani dri need mayonnais someth make littl creami deli style readi roll minut take pouch like tuna never tri give go think pleas especi tri flavor good best,5
know tuna bag may sound weird conveni delici fill home offic quick healthi meal,5
need mayo bit spici tast,2
love flavor besid lemon runni prefer sweet spici ranch great never tri tuna creation never even knew exist wish differ veriti pack,5
came foreign countri order,1
box miss pouch open arriv one miss hickori smoke sweet spici want return two box make right,1
good tuna enough big sandwich mix horseradish sauc surprisingli good tast tuna sald,5
usual favorit flavor disappoint tuna purchas amazon tast like tuna usual purchas realli wateri insid pouch never happen pouch usual purchas expir date good sure problem,3
best flavor lemon pepper smoke lot packag thou recommend,5
fishi odor tast guess tuna though like salmon better,1
yummi use salad,5
good,5
ever purchas lemon pepper pack look forward sampler pack want know flavor good lemon pepper good tangi pepperi side say packag box littl smash open flap realiz trade anoth smoke ranch bum true stori know unfair trade person shake fist air could least trade lemon pepper plenti anyway smoke tast good kinda like spam like smokey saltier side bad yet tri sweet one could ranch noooo sleep night know conveni long shelf life also worri go dwell way purchas still sad miss ranch refus get,4
want tuna salad sandwich without work rip open pack scoop muss fuss add slice chees tomato slice grill eat cold good stuff maynard,5
handi littl pack quick shot tuna way like hickori smoke favorit flavor someth everybodi,5
bought easili handl food grab go situat serv purpos substitut make tuna salad scratch good tuna two year shelf life room temperatur,3
good tuna,5
buy ton month,5
probabl favorit flavor tuna pouch delici,5
often take tuna creation lunch afternoon snack cracker perfect balanc protein flavor,5
great diet realli enjoy quit flavor,5
like around quick protein snack better price groceri store usual,5
yummi flavor buy,5
love tuna packet came next day cheaper buy local store piec,5
life tear open season tuna snack good straight pouch toast cracker mayo herb garlic flavor fairli close like season tuna readi eat foil pouch great quick snack refriger pretti tough packag toler fairli rough treatment,5
great valu great product,5
small amount,4
pack tuna realli nice go quick snack realli enjoy l flavor,5
delici inexpens,5
great valu quick servic,5
varieti pack seen store like new tast tri good,5
mushi icki tast like tuna salad purchas tuna salad deli style past pretti good anymor purchas first pack tast tri forc eat threw half away add mayo tuna fish make edibl manag eat remain pack add ingredi make edibl defeat purpos readi eat,2
good salad snack cracker also perfect unlik lemon zest salmon smell someth,5
yummi good sick ur belli someth alway eat matter belli feel,5
go wrong product like tuna love flavor price good probabl order great go need someth belli,5
impress stick plain tuna,3
add slice bread decent sandwhich add salad make tuna salad buck pop aprox reason inexpens ok tast meal,3
love differ flavor tuna get,5
averag tri anoth version lemon pepper tuna famili member tuna packet came spoon within packet spoon includ also need flavor tuna pay expect better pleas take review feedback improv line product would like tuna flavor product everi packetpleas,3
love flavor hous like eat dorito,5
favorit flavor packag great easi travel take picnic hike take much room pack protein definit worth money eat least one pack almost everi singl day buy like make lot cheaper buy store flavor great deliveri fast great definit recommend,5
get tuna flavor almost flavor ranch dress,4
gift local bank,5
conveni want slip purs briefcas car tote eaten quick pick snack alon favorit cracker delici right size calori,5
love lunch,5
make good tuna melt salti eat,2
happi came good condit,5
much flavor almost like plain tuna,3
came good condit outsid insid,5
love product great tast,5
like flavor readi yo eat uou travel lunch add anyth realli,5
tuna salad incred salti borderlin ined buy,2
great quick sandwich right pouch,5
delici price right,5
tast great also varieti price overal valu money go wrong purchas product thank,5
tast garlic herb weird flavor mostli tuna disappoint,2
synthet flavor,1
pain get packag side differ great bad,5
great valu ranch salti side,5
make sandwich second add green salad,5
good sandwich,4
great salad sandwich,4
good amount tuna packag oili fishi aftertast great cracker chees quick snack,4
deliveri good food good good amount price,5
nice way tri four flavor buy other,4
awesom stuff great tast easi open pouch bad price either alway fresh great tast sever flavor choos cant get enough,5
longer need favorit,1
happi qualiti flavor wait order,5
love ranch dress flavor fail like flavor tuna packet though,3
pretti good make sandwich make one mean eat want put fridg like littl bit crunch also net carb carbless bread close perfect price right,5
like easi carri packag throw one purs snack add cracker eat lunch tri flavor like lemon pepper best,5
expect flavor lack robust bacon,1
love realli good salad delici healthi,5
tasti great price,5
super yummi quick easi snack,5
eat regularli get protein healthi snack meal stay cours keep fit healthi hard littl thing like becom whole lite easier go day run put glove compart gym bag back pack etc everi time order pleas amazon product,5
know like two food lot necessarili togeth felt flavor love ranch hickori smoke sweet spici may translat like tuna much like brand chunk light tuna water water go also like lemon pepper although tad heavi pepper light lemon other go well tuna mileag may vari flavor chip someth might enjoy great price want tri packet flavor love plain light tuna lemon pepper tuna melt mix mac chees cracker,3
awesom snack go throw slice bag bread cracker usual whip halfway bike ride quick snack break,5
flavor good protein son love help get protein challeng time,5
pretti fresh get better,5
everyon famili love,5
exactli say packag drain tuna got ad flavor delici use often ad protein meal sandwich seem worth tuna price includ flavor mix also work great camp want drain drink tuna water trail arent even expens deliveri standard definit plan order,5
exactli say packag drain tuna got ad flavor delici use often ad protein meal sandwich seem worth tuna price includ flavor mix also work great camp want drain drink tuna water trail arent even expens deliveri standard definit plan order,5
exactli say packag drain tuna got ad flavor delici use often ad protein meal sandwich seem worth tuna price includ flavor mix also work great camp want drain drink tuna water trail arent even expens deliveri standard definit plan order,5
tast like pull pork slap bun,5
easi use tasti,5
thank,5
muy rico,5
first love type packag flavor tuna quit long time hesit buy larger quantiti almost store bay area pack know outrag cent pack longer feel like wast money indulg pack substitut entir meal order amazon month alway deliv within day order packag seem bit weird often come differ shape box everi time asid cardboard box damag tuna pack alway untouch packet receiv also year good store worri short expir date may vari area region order tast first start varieti pack quickli learn simpli tast better top lemon pepper sweet spici last month order sweet spici simpli get tire overal great product healthi afford tasti profession promptli deliveri everi time,5
tast much like tuna,1
lemon pepper worth purchas save money experi thank amazon,5
great side includ cold pasta dish plain tuna salad,5
fast food go protein max,5
love tast,5
brand seem bit fresher tast howev price point one superior varieti pack make pack lunch less bore,4
yummi add mayo ranch creami textur,5
nice portion size,5
great high protein snack ad salad,5
tast tuna cartilag throughout noth like eat tuna salad tast hard textur piec look even gross closer inspect guess cartilag someth wrong,1
love conveni flavor lemon pepper starkist tuna bring lunch eat bag without cracker favorit thing ad salad realli add flavor salad,5
dont eat carb like grab go love tast conveni,5
tuna creation ranch great quick snack overli flavor,5
handi easi go meal bought case use backpack trip day hike plan buy individu mayo packet use plain tuna pack found much cost effect cost less buy would get mayo packet quit good homemad abl carri without need refriger make,5
delici low calori high protein meal option,5
tuna like like mine oil refriger cold eat pack,5
smell tast like eat tuna even textur ident would done better get can tuna add mayo outsid brand abl make proper tuna salad bumblebe much better everi aspect,1
great flavor textur creami compar other also flavor good miss j,1
typic love ginger sesam howev fan combo tuna,2
love perfect backpack usual eat pack side mash potato dinner backcountri flavor particular favorit noth intens enough tast fishi love ad sriracha well,5
great,5
household fave,5
noth dislik,5
like fact varieti tast great conveni pick put bag keep go lunch mention tast great,5
healthi delici,5
conveni lunch,5
conveni tasti eat everi day lunch sometim late night snack cracker take one car might miss lunch love garlic herb flavor,5
great product truck snack meal conveni packag flavor seal,5
buy pack fals advertis descript say pack,1
tast awesom nice textur dri gluten free issu purchas,5
realli realli realli fishi tast use prepackag tuna salad can expect mostli plain tuna fine expect deli style tuna salad packag fine box arriv intact everyth product fine expect name tuna salad,3
favorit tuna salad packag nice low calori snack love dip crunchmast cracker price pretti great,4
want plain tuna that would order doesnt tast anyth like bacon wast money gross,1
good snack,5
need complet septemb weight loss program cost percent less groceri store win win great flavor,5
great product valu price tast great quick snack,5
easi use children well great sourc protein,5
varieti allow us decid one like zoom variat,5
purchas packag aid ww lifestyl disappoint portion size perfect flavor yummi throw vege instant delici tuna salad cost ww point,5
ridicul price increas,3
nasti vomit right eat tri nasti vomit bewar,1
tast good salad whatev dream put,5
love mi salad,4
disapprov tast thing portion size one sandwich good thing,1
dislik good valu pay also like flavor dog like flavor tuna would buy,5
perfect lunch dinner easi open packag true lemon pepper flavor fresh delici,5
littl money,2
alway fresh fill,5
kid hous homeschool last thing time everi day make meal stuff amaz perfect quick snack breakfast even lunch portion size enough cover small sandwich mean complaint eat normal cracker hand goldfish enough make hungri would consid meal see buy new box everi two week though guess speak worth,5
best purchas made awhil fact need order easi store prepar eat,5
great quick lunch love varieti pack good,5
star product tast good make nice easi snack,5
enjoy varieti flavor tuna eat tuna healthi,5
purchas keep hurrican suppli requir refriger tast great taken easi meal snack,5
good chunki enough good size sandwich mix salad,4
realli like flavor warm chill flavor die littl,4
alway love starkist tuna love bc make small portion,5
yummmm great flavor tuna salad ranch chip flavor nice light tuna plain far mayo wait nice ranch tuna fish sandwich soon deliveri quick awesom condit,5
tast horribl noth ranch flavor textur weird,1
absolut love varieti pack tuna delici favorit type smoke hickori wick good give tri disappoint,5
never order made terribl sick threw garbag first bite aw flavor worth rate even eat first bite,1
love stuff,5
use salad realli good,5
great deal tast great,5
buy pack year cheaper buy singl pouch groceri store great stapl item keep around hous flavor delici goe perfectli salad sandwich,5
easi handl easi open small meal incred tast much fuller select flavor small local groceri abl get flavor amazon could get store varieti nice feel like eat good food,5
good quick lunch work mess,5
packag flavor great,5
advertis,5
good,5
great flavor perfect portion size friend hold us hotel room decid restaur tri one pouch realli trick,5
one tri far tasti found need mayo order use sandwich,4
item recommend,1
sometim get leav desk work lunch pouch starkist tuna variou flavor drawer along plastic tablewar mid day meal,5
terribl tuna mushey would buy,1
realli want like conveni protein water chestnut realli flavor right sinc entir case probabl add macaroni salad hope best also want mention children care either,3
great item price like varieti item quick shipment,5
flavor surprisingli good,5
yummi lemon pepper tuna one famili favorit good pack school lunch need utensil eat right pouch good cold,5
think preseason packet tuna one greatest invent ever pack cracker roll slice bread eat pasta easi peasi wish would thought year ago come varieti flavor bit deli style season tuna favorit glad deal,5
got box save purchas amazon eat salad everi day go fast save amount money help,5
tast good sunflow oil one tast sour wet mouth,3
delici,5
like deli tuna love make quick sandwich minut lunch,5
garlic herb favorit flavor,5
love snack,3
enjoy tast right amount sandwich eat cracker take three day week great buy tast,5
great tast love lemon pepper flavor also eat pack use cook made best tuna casserol ever made,5
omg love flavor packag onion quick serv morn breakfast lunch snack urg someth eat go daughter thrill one morn agre add review pleas dont stop make pleas dont chang flavor fine way leav way pleas continu god bless read review drop like appreci god bless everyon,5
tri varieti flavor good live without,5
flavor fresh usual ship quickli arriv good shape handi keep truck,5
love flavor hickori smoke alway fresh great valu,5
move bargain,3
low calori high protein perfect portion size easi grab go,5
great product flavor amaz,5
perfect size diet perfect portion size tast pretti good complaint end,5
gone lot starkist individu tuna varieti littl cup spork hidden lid thought see compar sinc basic eat home day take lunch break pretti much tast perhap littl better could simpli guilt involv wast packag rip top bag cut get torn put bowl dish cracker bread throw prepar salad tasti protein singl serv never smoke tuna get varieti pack allow see daughter order prefer option littl bowl sweet relish pickl ginger fanci oat cake cracker finish fresh orang quick lunch buy varieti pack like stick hand box pull surpris flavor,5
well preserv realli like place box everyth take realli good care guy order custom also,5
great product,5
right size one person make easier protein includ fish price right,5
flavor tuna pouch haha love tuna salad kit go flavor pouch make quick sandwich top everyth bagel eat straight packag lunch box stapl,5
love conveni item easi use excel protein sourc low calor fat content also econom could ask would purchas item,5
super yummi great way sampl differ flavor,5
got pouch instead never realli count mani buy mani wonder mani box order miss pouch,4
like packag tuna starkist alway favorit far best flavor tuna buy,5
great valu better local groceri store delish,5
alway take hike trip great quick sandwich easi store away bag,5
portion size littl small realli hard pair correctli anoth side dish make okay meal pair someth rice solid choic well cuz cuz,4
keep pack close readi use eat,5
low calori high protein great flavor use mid morn snack straight packet mess,5
love varieti pack get tri differ flavor without wast,5
cheaper easier get bulk,5
realli good,5
use tuna oil mayb like also made buttermilk tast ranch almost like garlic onion major flavor,3
sure fan rather type tuna salad plain tuna way flavor perk quit bit realli good,5
far best flavor tuna packet market love tuna straight packag noth ad also make excel tuna salad sandwich littl miracl whip use tuna make tuna leek quich great success also great add frozen meal extra kick protein ad mexican dish sinc start cut meat seem find store around nice buy bulk amazon,5
good like box got bad would recommend,2
eat year come varieti favor herb garlic one favorit easi use none messi drain requir can good stuff,5
good easi store bad strong fish smell white tuna tast dri poor qualiti tast like cat food bottom line tast bad strong fish smell tast like cat food someth make dri stuff aw,2
tuna fresh flavor way box came smash item way overpr compar supermarket get,2
tast horribl tri two packag could finish pack normal order tuna salad snack pack cracker enjoy never buy,1
best flavor tuna pouch,5
order product starkist seem discontinu ginger soy chicken pack love rule like chicken better tuna higher protein seem fresh great flavor littl visibl chunk ginger pepper well even felt healthier one pack work well rice noodl overal satisfi,4
realli good tast perfect picnic sandwich summer would tast great lemonad soggi extra moistur dri enough sandwich salad right packag eat kale mayo salad lemon pepper tuna great,5
love throw backpack fit great pocket differ flavor oil water tear packet eat pleas provid oz packet,4
great tast tuna salad toast english muffin slice chees delici quick lunch,4
great portion style tuna add bit mayonnais bread use quick lunch well midnight snack,5
yum,5
great husband lunch work,5
order time,5
interest flavor good way tri know one would get,5
anybodi strive make diet healthier without compromis flavor starkist tuna individu packet easi place start conveni nutrit low cost tasti individu foil packet unsurpass arrang plate starkist lemon pepper tuna cottag chees cook beet avocado blueberri healthi bake cheeto satisfi nutriti meal ad splash hot sauc es muy bien,5
great product great price tast great high protein low calori,5
tuna dri flavor better flavor conveni make quick easi tuna avocado rice bowl add lime gochujang sauc salt,3
product gluten free contain dextros,1
fine flavor expect,3
price point order,5
great price product kid grandkid love fast deliveri better valu local groceri store thank,5
easiest thing world tuna salad pouch readi go eat right pouch like snack scoop pouch onto sandwich pouch perfect portion one sandwich put plate cracker bed lettuc calori whole pouch fast healthi lunch need add anyth delici,5
better regular tuna,3
love much year road warrior alway carri coupl packag plastic spoon briefcas inevit time would get stuck somewher noth eat packag two even plain packag enjoy satisfi would enough tide also came handi time lunch dinner meet would brought everyth meat sinc meat eat fish even though longer road warrior still keep healthi suppli pantri sometim crave bar b que hit spot also make easi carri eat snack lunch especi also carri pack cracker coupl piec bread review starkist tuna creation honey bbq ounc pack,5
purchas use camp hike hardli flavor need add mayo addit spice,2
love happi camper,5
local grocer usual good tuna recip,5
littl much lemon side two three kid develop seriou sore mouth eat spous fine sensit mouth unless cut lemon someth like salad grain potato etc good acid,3
came perfect condit great price,5
love flavor textur size serv,5
easi use flavor power still littl zing,5
sodium content seem bit high work great plan salad,5
great lunch,5
