x,y
smoke flavor gross,3
love everi bite conveni packag,5
love stuff carri lunch,5
alway fresh n tasti perfect keep cabinet work,5
good tast tuna pouch less liquid mean less wast space,5
bought groceri ranch flavor downright disgust im picki eater,1
drier usual order,3
huge fan one flavor weird salad concoct tast good regular tuna hickori smoke exampl cheap get,3
got healthi snack move extrem salti rather dri ad mayo help would make sandwich usual carri mayo handbag intend start may well use can tuna make sandwich ahead time emerg ration long water wash,2
great high protein snack money think hard beat,5
tast good,1
love flavor buy bulk like cheaper get store,5
tast good one eat home,3
great quick lunch work cracker bread need add anyth water chestnut add nice crunch,5
best snack,5
box open receiv,3
worth purchas sale groceri store fault pay attent,1
wife love put salad use around pack month,5
love mix light sour cream make faux tuna salad eat wheat cracker realli good,5
tasti,5
waaaayyyyy much tuna fish flavor smell overbear dog even want threw right trash open one pouch,1
order hope new flavor might spice tuna option found flavor abit would tri said qualiti expect starkist juciy good clean tuna,3
ok,3
love,5
bought husband take lunch like said tast like cucumb celeri salad mayonnais surpris hear guess egg yolk list ingredi give mayo flavor husband like said littl bland compar flavor tuna tri price good time get tuna pouch less good price,4
eat starkist year great qualiti tuna make conveni high protein snack meal workout howev upon receiv packag open discov pouch huge deal sinc one someth awar,3
like flavor,4
sooooo delici addict,5
alway enjoy lemon pepper flavor,4
buy husband take work lunch prefer light lunch perfect refriger requir readi eat provid good amount protein well like flavor even one sound littl strang price less good buy cost groceri store,5
nice way tri new varieti flavor,5
like flavor,4
varieti pack make tuna less bore good hurrican food,4
great buy,5
tastiest packag,5
nice healthi snack,5
starkist tuna creation lemon pepper tast perfect worri smell would say bad also let five friend tri product like recommend,5
kept wrong item good decis tast salti plu add condiment sweeten tast,1
order,1
tuna salad ok add favorit add on like photo pack show,3
great varieti option,4
gift someon colleg said good stuff,5
conveni go person tast good sweet spici without spici buy product fact set deliv everi month prime pantri,5
good solut job meal,4
good tuna,5
herb garlic great flavor stand flavor order onlin sinc alway sold kind store,5
love tuna add coupl pack along condiment albacor make one delici tuna plu state darker tuna better dark anyway,5
love,5
tire buy groceri store everi week kid eat fast buy great go high protein food save money purchas bulk,5
delici,5
good price quantiti tast fresh time,5
pack lunch,5
total enjoy packet tuna easi open put cracker snack time,5
great,5
readi eat starkist tuna salad come handi make sandwich eat littl drier tuna salad make fewer ingredi individu prefer alway ad packag product,4
love great go,5
love,5
stock local groceri buy add interest flavor ordinari tuna salad famili like bit grate onion pickl relish dash hot sauc thai chili sauc mayo done gone nanosecond,5
add bread pickl,5
bad definit order smoke salmon flavor one next,4
great addit salad,5
would recommend,5
great tast conveni use diet one serv easi calcul calori,5
great comfort back know eat take littl pantri space tast great,5
nice sandwich salad ad pasta,5
stuff terribl ts like eat school past without much flavor,1
herb garlic amaz hard find addict,5
love tuna refriger nice refresh sandwich,5
one worth buy lemon pepper,4
conveni tasti,5
love tuna especi hickori flavor delici healthi easi flavor strong enough mix plain tuna still tast good,5
made sandwich toast wheat bread tuna right pouch tuna swallow tri mushi wateri unpleas flavor,1
use like product hardli tast tast much like tuna might good peopl bland shame,2
go hungri great tast,5
great,5
love flavor,5
love tuna use without use mayo great salad topper grill tuna chees sandwich right pack quick protein snack,5
okay mayb love bit much tuna pouch go cook low calori protein add spinach salad put toast quick sandwich eat right pouch ranch marinad make tast almost like tuna salad calori mayonnais,5
kind bland side prefer walmart ranch flavor best flavor opinion honey bbq,3
easi n delici perfect go snack lunch,5
enjoy conveni tuna pouch tear top away done flavor bland peopl might want spice tast like crunch veget salad along tuna mushi work,4
simpli love tast,5
thought would bigger pouch like one dollar store solid pack water good calori lunch protein snack,4
use go littl bland,4
love box wish could purchas box one kind rather varieti pack may contact local store purchas case mix pouch favorit dress mayo miracl whip use cracker dip spread bread sandwich also love top salad wait chicken pouch,5
use subscrib save option deliv directli work back lunch afternoon pick up great price tast,5
bought nutrit tuna salad make meal prep expect would tast good homemad tuna salad still pretti disappoint tast think water chestnut make tuna tast dri bland tast like albacor tuna mayonnais noth entir makeup salad bland dri hard get self use hot sauc make tast like someth nevertheless think worth price use week time prep meal lack time manag suffer bland tuna sometim worth buy conveni healthier snack get price point use three packet three wasa cracker make meal,2
high blood pressur pleas cut salt otherwis flavor good,1
like conveni,5
great lunch low calori,5
exactli look tast asia tuna pouch,5
tuna packet could easier tastier way get addit protein diet lemon pepper flavor quit enjoy tast great ad salad bulk option great workplac,5
exactli look need portabl protein includ care packag deploy militari certainli fit bill soldier angel look onlin wonder organ absolut love abl creat packag includ thing men women need men especi ask protein tuna pouch offer good amount protein nice varieti flavor expens send,5
good,5
fav creation good,5
get tire check display local store find shelf empti though bit expens store sale price avail need count product much favorit mine,5
great purchas,5
eat afternoon snack work cracker price went walmart without go walmart,5
product chang without te ling calori mean less tuna gr protein much differ e tast u someth good wreck,2
like anyth tast strong like past order,1
good valu kid favorit flavor,5
know sure lemon tuna need buy,3
son law take work use keep blood sugar check day,5
conveni way get healthi protein day,5
excel,5
look find store,5
gross real ranch flavor buy wrong check tunafish msg,1
great lunch,5
tasti,5
great quick easi lunch,5
low carb diet tuna creation hit spot ranch great tast purchas l tuna creation gram protein,5
great lunch go like ranch one better,3
purchas pack varieti receiv deli style real hard comprehend know,1
conveni flavor pouch travel store anywher go meal,5
packet well made arriv intact insid anoth ship box like flavor amount packet handi sometim use one envelop household small unpredictbl schedul great product us,5
good flavor choic overpow smoki like,4
love lemon pepper tuna starkist packet conveni,5
good flavor good consist good amount conveni great protein ratio,5
pouch,4
pruduct bad tast noth like tuna tuna salad product ever threw packag away,1
eat right bag,5
starkist tuna one favorit sack love fresh thank terri j barn r,5
favorit,5
label backpack friend easi keep readi go backpack need refriger fact preseason make nice flavor option lend quick meal easili,5
good,5
realli great tast great low calori high protein option buy box differ varieti everi month seem everyon favorit,5
better homemad tuna salad carri packet purs quick go meal especi substitut teach easi open eat straight pouch serv gener,5
ok continu buy,4
longer get local groceri store tuna nice fresh flavor good slice bread packet sometim put kalamata oliv sandwich time sweet bread butter pickl,5
care favor,2
lemon great companion flavor tuna right balanc easi carri packet without mayo dress realli hit spot,5
tast great,5
recent begin eat tuna find starkist pouch spici tuna great great price happi snazzi photo cover packag great tast fussi eater,5
lemon pepper ranch tri first think familiar flavor like wrong dri mayb plan chef add want make creamier moist expect enjoy tast like tast abl eat ad season ranch dress etc sandwich like tast hope spicier flavor better tast want tri yet,2
great job packag alway rememb apo mean oversea militari appreci receiv product unharm,5
yummi low carb,5
keep sever work along pack tortilla never worri forget lunch quick neat inexpens delici healthi pretti fill love price pretti close pay local much better shop somewher els,5
love flavor packet conveni take travel sometim tuna bit dri side sometim pretti wet,5
first enough tuna salad one sandwich ad sandwich tartar sauc sinc pickl onion mayo quick easi lunch snack count order make sandwich packag meal cost product good short long term storag packet best use date oct buy,5
delici,5
perfect catch tuna need,5
great grab run lunch snack,5
conveni good price,5
star,5
conveni,5
like sweet spici tuna flavor best flavor avail use make sandwich work sinc need refriger simpli open pouch put bread add whatev els want lettuc tomato etc lunch soggi sandwich,5
buy,5
paid got pack arrang pack one pack pouch wtf truck driver order food week road leav serious short disappoint,1
great buy,5
good flavor,5
tuna tuna fine conveni packag hike trail,5
love differ flavor,5
great,5
delici,5
easi good nutrit keep well shelf good flavor,5
delici satisfi flavor great,5
first one bought two case love,5
love prepar tuna delici conveni perfect amount sandwich also eat cracker sometim,5
convien,4
subscrib save year half cancel took good product improv bad product use calori g fat new formul brand tuna creation calori gram fat unfortun think achiev either remov mayo mix switch mayo altern nonetheless use tast like tuna salad albeit bland tuna salad tuna salad nonetheless tast like flavor tuna e like creation product fine want eat right envelop fork like old formula origin deli style creation label pleas give back calori g fat product actual tast like tuna salad use go high protein low calori snack throughout day,3
like choic,5
amaz tast five year old year old love amaz get eat protein high qualiti,5
go wrong dollar easi store work great snack healthi love ritz cracker,5
delici,5
alway forget fork wish need one,4
hook eat lunch wonder tast leav tuna smell kitchen,5
great snack keto dieter,5
love conveni seal pack tuna salad love tast good sandwich good cracker good ad pasta salad alway want keep delici time saver hand,5
tast great,5
muy buen precio,3
delici practic use quick meal good amount select love hot spici sweet add cole slaw add cube appl ad textur,5
keep handi work tast amaz littl tuna odor fulli recommend,4
box came bust bit packag tuna pouch fine lol favorit hickori smoke,4
handi,5
thank,5
expect thank,5
pack flavor pepper lemon two flavor expect like love much plan order go product chang meal,5
wonder lunch quick high protein snack must buy pack lunch,5
great buy,5
great protein need conveni protein fit need tri ranch flavor next ranch bought month like sauci tast sweet n spici sweet n spici flavor good favorit get ranch flavor month go start get price sweet n spici spici spici also kind sweet reason remind crab sauci like ranch flavor,5
readi made tuna salad lunch easier littl pricey otherwis great,5
tri eat healthier start pack salad work like lunch meat alway time cook someth great one flavor way better expect keep locker work good sourc protein calori,5
good great price tast good given pouch,5
good great price,5
great price good varieti use quick easi lunch,5
easi flavor,5
care littl pack delici kill via mercuri love eat two everyday know ideal addict put white rice littl butter salt,5
absolut favorit tuna,5
worth everi penni,5
tast gross,1
fan can tuna need high protein grab n go snack meal easiest thing could think flavor help textur still like alway work pinch though,3
minut lunch,5
envelop littl bit tuna tast like tuna use gave away ladi come aid took noth said sorri,3
like,4
love varieti one pack get tri differ flavor,5
definit find cheaper elsewher god damn realli good,5
great flavor easi keep drawer work time lunch,5
good varieti,5
delici,5
qualiti,5
great item,5
great tast price w pack good easi use work quick nutriti lunch,5
bueno,4
yummi,5
like conveni open packag readi,5
great tuna packag add mustard,5
pack fork good go excel lunch idea alway go busi work,5
long time fan origin tri sweet spici also lemon pepper dri crumbley stick origin,3
nice mild flavor conveni packag great pack lunch bag,5
first time flavor pack tuna thought delici reorder sincei handicap make easi prepar snack meal truli good,5
man love stuff opinion tast better plain spring water tuna sometim find pack less buck great deal alway stay stock lazi go groceri shop pop pouch keep full like buy nongshim shin bowl ramen also amazon top pouch hickori smoke tuna put microwav great combo,5
love one favorit,5
far best tast packag tuna price outstand use product go meal power outag tropic season keep coupl extra pack edc bag,5
ok tast,3
great quick snack lunch messi liquid deal tasti,5
tri almost everi varieti starkst pack everi one tast good great,5
fantast lunch snack great packag easi take,5
good buy time,5
one fav cheaper local store,5
came fast tast great,5
good price good select good sandwich salad etc,5
itsso flavor ful eat right packag cracker,5
favorit flavor tuna creation take anywher low calori reason sodium super conveni could probabl live thing get tire take work nibbl need bit protein morn amaz,5
love tuna protein get eat meat seduc good review product bought flavor review said best ranch took one bite could bare swallow would give dog love much review describ creami would call mushi real tuna flavor realli nasti tast stuff deli version return stuck way tri ad mayo salvag,1
nice varieti tasti tuna,5
box say pouch varieti pack got two hickori smoke two ranch advertis,2
new favorit snack great go quick snack protein sourc alreadi order twice,5
stapl lunch,5
one packag right amount one person good flavor good price,4
person like tast,3
suffici amount sandwich,3
got pack instead oddli packag well,1
go protein snack even without cracker anyth els delici portabl easi eat,5
love particular flavor eat everi day midmorn snack,5
awesom flavour stack,5
mani comment good agre combin anyth everyth mani fine exampl like cornbread hot sauc egg also go wrong,5
wast money two star portabl need open,2
good,5
delici,5
awesom lunch snack mix miracl whip relish,5
compact tasti perfect go,5
far favorit flavorof fan tuna like bacon ranch willlov,5
beat flavor brand tri love tuna andbacon ranch dress give atri,5
great lunch,5
mezcl con un poco de mayonesa se arrepentir en mi pa es un poco dif cil conseguirla por lo que esta opci n resulta factibl,5
forgot lunch time ubereat keep handi add cracker,5
tunalici,5
awesom food,5
pleasantli surpris tast great conveni price great,4
great flavor perfect go snack,5
work alot someth quick healthi grab nice also worri shop,5
size packet,5
man good tasti right pack make delici tuna melt littl shred chees,5
love quick lunch yummi nutriti best part theatr conveni buy,5
yummi littl packag price,3
great tast conveni light lunch even light supper,5
alway favorit hous tast great perfect size lunch good snack,5
perfect oz pkg occais time,5
love particular flavor came fresh issu product found sale local store better deal per pouch usual purchas,4
love conniv packag water drain flavor tasti throw one purs backpack quick snack middl day,5
hickori smoke tuna best flavor perfect smoki flavor pair protein pack tuna priceless,5
like travel use save stop fast food go restaur drive day like get motel relax dump luggag go find someth eat put snack cracker make meal along fruit drink sometim salad pick one travel stop,5
reason price,5
quick easi,4
great littl healthi lunch,5
tasti,5
multipl choic box,5
found nemo tast great,4
littl dri bag ad teaspoon mayo oliv oil sprinkl sea salt good go travel late night snack,4
littl flavor sale,3
like smoke salmon hickori smoke tuna flavor delici much lower price,5
tast great go snack meal,5
one great make peopl eat tuna,5
tri ranch far,5
realli enough one packet,4
love lunch eat straight packag add salad cheaper local,5
could bit,4
describ,5
awesom flavor conveniencei eat right pouch mostli top salad,5
expect bacon bit,3
great product great deal pouch help,5
bacon ranch tast like liter fart mouth everi flavor good though,3
disappoint particular flavor definit tast bacon ranch tast like mayo,3
find conveni sadli impress tast star overal,3
salad sandwich straight pouch,5
love tuna pouch ginger sesam absolut favorit thu far still tri exot flavor love one ugh thank make afford,5
like can tuna thought bargain tuna crave horribl tast look last chemic ingredi list sum artifici mush tast thought cat would enjoy rins mesh colendar pick onion disappear eye tuna,1
happi found product seem find anywher els tad expens would expect hope,3
tast great quick easi snack love,5
nice,5
like varieti tast use salad sandwich,5
cost less per pa k walmart,5
absolut love product spici sweet right mix quinoa lunch half avocado perfect,5
awesom price,5
tast like bacon bite low fat ranch,3
pick nyc need someth low cal room never imagin would good tast like deli tuna salad enough nice size sandwich ww pt blue plan yummi order whole box today,5
best tuna ever happili enjoy directli bag mix salad sandwich melt smoke flavor subtl strong delish,5
receiv nice pack yet tri,5
better store,5
first time tri tuna packag hesit one review said would rather make home okay understood purchas food eat hike delici ate toast bread home still delici deli style good truli recommend wait tri flavor,5
order one flavor got anoth complet differ type tuna,1
everyth tast fresh season,5
like eas use tuna make sandwich,5
realli like flavor lemon pepper,3
tuna wateri like can easi carri around,5
son love hickori smoke tuna use subscrib save howev find small bone last deliveri,3
tast good fishi tast,5
great valu money good protein great wrap,5
know like best sweet tangi delici tast tuna versatil meal use fact come readi eat individu fresh pack pull tab open open fork sweet spici tuna oil drain never found singl bone realli enjoy product,5
great valu price flavor,5
great love,5
valu money great opinion flavor lemon pepper one best hickori smoke even swallow,3
great car work orcamp backpack,4
tast great ranch power make quick sandwich cheap price way go,5
perfect make sandwich go,5
easi take eat,5
quick easi use besid delici,5
sorri stuff gross number one open tear open packag without scissor number two tast textur like cheapest tuna buy upsid see two year shelf life save surviv kit sure food run tast wonder,1
ok noth write home flavor other good basic go snack especi travel,2
honey bbq flavor realli good remind pull pork odd sinc realli tuna still tast good either way,5
tast worst diet food go see return case want day time cook day went gym tast aw tast noth like tuna two year old grandson love tuna well son made decis read review boy wrong time recommend tuna mayb brand alway brought case bumblebe tuna come cracker want cracker need gluten free one gave option get cracker,3
dollar pack mix creami chicken ramen unbeat,5
love tna creation,5
love take wotk tortilla bread sometim cracker right pack delici,5
alway get salad work protein ad cost lot money budget add pouch two salad realli fill tast good thin easi carri backpack buy tuna sale though,4
absolut delici best way found get starkist tuna without go state pop great price,5
close expir date,1
less happi reciev flavor suppos garlic herb otherwis tuna,1
love,5
best flavor cut done size rais price sinc hickori smoke came,5
wish littl pouch mayb littl packet addit season,5
tast like regular tuna super conveni perfect amount tuna pack thumb,5
tasti conveni product howev seller price mislead expect packag price pay fortun product back stock groceri store,3
love tuna tast good buy,5
love get product bulk sent hous feel bad wipe groceri store,5
tast good eat school realli strong smell classmat thought eat poop,4
love hard find differ flavor good tuna salad quick sandwich salad great,4
ok first like tuna thing toss mac n chees add lot thing boost protein eat meat eat fish egg chees meat pro tast love lemon pepper give enough zest make tuna find bland flavor think squeez lemon gener help pepper tuna get cost got packet buck may gone still deal quantiti one pkt great one person present like sooo much tuna water log moist still flaki like tuna like like squirt lemon good dash pepper tuna find great make tuna melt lemon pepper give flavor snap ad mac n chees put veggi quinoa bowl get tru root quinoa mix add lot protein even eat packet tuna tast bland jazz make palat tast subject though like tuna lemon pepper like,5
fast deliveri item describ,5
tast great tuna liquid squirt tri drain,5
easi delici,5
good flavor textur sawdust hard get packag,1
need return tuna drain pack,1
food money buy month number peopl get sick possibl get sick grow glad got small suppli last check come live flour tortilla tuna fish year homeless sever year back almost treat today crack pack tuna ate flatbread time didnt squirt chees mayo fridg yum,5
store usual mani want buy bulk purchas great cost local store,5
love tuna pack take work cracker make quick cheap healthi lunch,5
love tuna tast good deliv box damag,5
great littl packet one serv last time groceri store left guess due peopl stock viru blame anyon one bit anyway came quickli price reason penni wm deliv door drive mile get amazon rock,5
love four differ flavor tri know one like best though lemon pepper realli great,5
flavor nice conveni carri good salad,5
bought supplement tast spici conveni open can one,4
hous broke bought box first time order box today eat everyth love get rona,5
great price great tast,5
someon put box got box non return make price per pack jump tuna good oh yeah bet cost twice much get half much can part realli suck tuna good tast eat pouch fork take minut,4
expect smaller packet nice see standard size tuna packet gener amount tuna insid flavor quit distinct part pleasant understand need add sugar sweet spici flavor question addit sugar ranch lemon pepper flavor everyth diet need sweeten wish manufactur would stop ad needless calori food item requir,5
great servic even crunch time caus viru,5
kid love snack sometim jazz onion mustard went first pack rather quickli back look like quarantin lockdown extend,5
best flavor hand tast tuna tast like pull pork love better flavor find flavor anywher,5
tbi product eatabl realli serious terribl pleas refund money,1
tasti,5
packet tuna perfect size quick lunch usual mine cracker quick easi flavor great,5
addict tuna great altern go store empti suppli definit order tuna onlin also one favorit flavor yum,5
packag tuna rip,1
great varieti tuna great snack go worker camp,5
ranch flavor zero ranch flavor fish soak wet recommend ranch flavor tri spici prefer spici hot lemon flavor gross tart bitter,5
wonder qualiti flavor,5
hope someon amazon pleas count thede packet custom report alot miss packet lost worth cost less custom pay,1
charg per pouch bumblebe work vendor decid seek cheaper altern includ spoon slightli tuna per pouch fyi flavor juic like settl whilst mention would seem common sens shake pouch break herb garlic expect flavor overpow garlic lemon pepper zesti lemon juic smokey black pepper flavor ranch littl bland side alright subtl note sweet spici defin sweet sometim spici one highli recommend shake pouch one pouch spice kick reason go tri honey bbq next base review skip bacon ranch base big smoke skip hickori base redicul doubl price per oz skip ginger sesam sure crisi ginger simpli amount ginger product caus price vs pouch right econom comparison enough varieti otherwis avail,5
describ,5
long shelf life pretti healthi go wrong,5
gave two lemon pepper sweet spici thank lot de like get pay,1
product great hous bound usual buy hurrican season unfortun share cat,5
like sour salti flavor regret,3
love conveni tasti,5
almost hate review afraid get sold pandem like store haha said happi purchas packag intact product fresh expir date may april flavor tasti surpris favorit sweet spici expect like lemon pepper howev good per pack slightli cheaper better select find local store win win,5
great tast,5
good go pantri item minu one star difficult get product pouch like lemon pepper ranch flavor best,4
husband take lunch everi day work low carb diet huge stapl bc cannot put lunch refriger conveni say rate great,5
tasti,5
ok never,5
use individu portion pouch top salad make sandwich although also good alon fresh veget carrot celeri etc perhap cracker season varieti save time flavor tri disappoint spice balanc garlic overpow tuna salt content high mg percent daili valu calori per pouch quick easi way add gram protein diet pouch usual long shelf life one except good year futur although date vari,5
great sourc protein tasti great price,5
easi lunch,5
great snack,5
like put tuna fish salad lunch groceri store ran everi one panick got week flavor order cost half citi market charg,5
love tuna,5
paid come pouch,5
quick deliveri great price great flavor varieti valu got awesom better price sure,5
decid tri flavor whim tri eat better thought might way start found new favorit need addit make toler open pouch along cracker fantast satisfi lunch alreadi order home work,5
pleasantli good flavor pouch make life easier like tuna go wrong starkist read review wonder peopl actual like tuna go five star tuna plate cut go get qualiti cheap price number recip idea websit,5
get flavor tri varieti pack lemon pepper ranch flavor tast great sweet spici ok smoke flavor hate stick flavor like,3
