x,y
arriv well packag sit comfort man woman child tight seal,4
feel secur comfort first time wear hurt littl bit ear wear hour straight l realli good mask second time buy,5
great fit possibl teen small regular size adult male might fit smaller size male chemic smell allerg reaction claim overal great mask abl wear requir travel aso go emerg backpack howev still search fine one husband would buy tho leah spous,4
excel mask work,5
mask great,5
arriv time even day delay ship feel soft cover well,5
work well fit well overal realli good mask,5
mask fit well comfort expect,5
mask look nice onlin mask receiv felt cheap fit right look like beak stick far,1
job look good fit well,5
small person round face fit face made adult narrow face kid,1
heat outsid mask feel thick warm would want wear work physic challeng job even go brisk walk shop visit doctor indoor task comfort well fit breathabl fit adult face teenag daughter face well,4
fit well breath air flow jet stream eye regret buy,1
overal comfort good fit fine issu bit fragil strap break,4
chengd technolog co ltd misus niosh test inform regard wwdoll model cd b kn foldabl protect mask mean model could approv well read approv mask list cdc,1
mask fit face well femal say face bit narrow normal issu adult mask big children small concern transpar area like plastic heat stitch keep layer togeth feel harden like ear loop attach keep layer mask togeth even tri blow clear stitch area feel air get seem press togeth heat like ear loop rais alarm see appear hole first glanc,5
pretti good wish tad bit tighter fit better deal,4
mask protect lightweight easi take great staff work,5
mask comfi look ok job,5
realli love mask tight around ear like mask make hard wear bought famili adult parent colleg student elementari schooler middl schooler fit face well comfort face feel like breath harder pli filter,5
pandem hit around definit need new mask protect us,5
made china would recommend note affili fda approv mislead kind mask shed small plastic plastic deriv particl right lung caus extens damag recommend use find made usa,1
purchas kn mask find anymor amazon tri work seem sturdi well made scratchi skin gave like black look dirti,4
good overal qualiti ear loop loos wide face,3
good qualiti complaint,5
good qualiti like color,5
bought mask second time realli like qualiti second order set mask mask much thinner appear cheaper qualiti buy,1
poor qualiti purchas,1
fit nearli snugli face kn tri brief strong odor first wear mask effect fit well extrem disappoint product,3
good product put light see hole decid purchas use filter better coverag use first day honest opinion,1
like fit comfort,5
wear mainli dark blue color want match dispos mask realli cute,5
wish nose piec littl comfort howev fit husband well,5
necessari today societi work well,5
comfort,5
love complex breath wear,5
block dust cooler mask worn,5
easi breath gap like thick mask well,5
mask comfort make feel safe secur fit tightli would hope take decent amount fiddl nose bridg get fit feel air escap side elast band tight loop realli make fit tighter got better fit powecom kn still job though hope need long,3
best kn ever use doctor oversea want someth safe famili face mask deal mention realli comfi,5
mask comfort wear day easi,5
work great test use clean bathroom smell chemic buy anoth pack,5
want black white,1
thick thought would make wonder realli kn mask comfort made well stick older mask,3
feel way thin healthi layer,2
start use mask pretti cloth mask wear howev doctor offic hospit take cloth mask want wear dispos mask made heavier materi plain cloth silk mask accept doctor hospit uncomfort thing face glass fog creep way face eye hate,2
mask comfort better breath,5
teach mask one work offer safeti,5
good stuff,4
get tight seal around nose air escap constantli goe eye everi breath,2
best n ever use,4
like weight comfort way fit snug around face,5
pleas purchas happi safe journey,4
mask decent level thick make difficult breath fold well around nose uncomfort wear long period time,5
work asthma littl hard breath keep smoke fire,5
smell bad practic unus ear loop short use child,2
someth wrong mask smell bad seem make feel weird tire wear short time also fit well pretti loos seem filter particl well either return tri,1
mask great make easi talk,4
fit well comfort,5
agre other said thing mask much much thinner last two time bought notic thinner clearli differ product return mine bad previou version famili favorit dispos mask air travel,1
product seem fine mostli get fit snugli enough face elast strap loos mask quit tight enough face,3
mask fit snugli comfort face leakag area even wear glass mask without fog glass,5
excel product,5
mask well made comfort provid protect need,5
comfort give space mask nose mouth make breath easier,5
lo el stico son pequ os la oreja la dobla para al frent,2
protect,5
love mask comfort light make feel like suffoc highli recommend,5
cours scientist know protect advertis reason comfort although littl tight must wear one day hurt ear seem fit well,4
great product,5
product fit,3
tight around throat smaller peopl,4
find mask better fit major cloth mask offer better protect,4
noth dislik gener covid protocol,5
tri fit perfect tight loos use the eon plane travel,5
good mask would buy problem teenag like well,5
comfort light weight great airplan trip,5
bone month ago bone yike,4
mask well made fit face gap nose wire pinch secur much breath room insid type mask,5
deliv fast ahead expect time expect,5
perfect product,5
light weight comfort,5
mask good conform face fog glass,5
noth dislik excel product,5
like mask hurt ear breath,2
well fit adjust metal nose band well construct aviat career famili mask wear long period time mask comfort equal comfort ear strap use lot hold togeth well without fray break,5
fit adult face,4
comfort good protect korea seal approv,5
mask fit well breath well,5
back mask wear like beyer cloth mask easier breath,5
mask fit great easi adjust comfort breatabl,5
overal fine bit larg smaller face quit lightweight thought would fine,4
father love,4
love work great,5
face mask fit well prevent glass fog fit snuggl purchas differ color move place talk great purchas money,5
awesom product would recommend order,5
wife use mask round trip cross countri flight seattl pittsburgh back comfort get soggi lay face like mask passeng wear believ also provid better fit face mani design,5
order sever pack love howev batch fit good last pack bought seem bigger lot thinner result fit snug last one also previou one bought layer stitch around perimet seen pic excus makeup two follow later term qualiti nov review updat mask work great ye larger fit order strap clip allow mask fit snug place,5
appear real thing know comfort averag size face strap pull ear believ need longer peopl ad length strap comfort slight smell plan air use stay healthi,3
mask fit well easi breath minim fog glass side mask slip littl convers someon,4
open inner plastic packag met power chemic odor could even tri mask power chemic odor even let mask air hour still cannot wear mask learn lesson buy genuin n mask made usa,1
ultim mask airport buse crowd train subway give much protect simpl surgic mask difficult breath strenuou activ,5
use sever area covid work great quit breathabl,5
mask made way make easier breath shape glass steam nearli much mask would nice adjust ear band,5
use face mask husband took flight florida arizona well made fix right mouth part realli like even mess lip gloss lol yet fit good around rest face,5
stay away mouth nose improv ventil appropri use,5
product okay work realli well howev breath feel like suffoc,3
product great good peopl wear glass,4
similar type mask korea love look get seem like would fit bill differ even though visual look similar seem fit face well one even nose bone press fiddl mask find exactli right spot nose otherwis even though press hard still feel air come top hit eye breath also strap one interfer husband hear aid strap one someth angl come mask ear differ caus problem,3
found nyt review best kn mask one top reput manufactur mask lightweight good fit often forget take ear strap make fit right without tight stock order yet receiv day,5
previou packag mask compani like lot therefor reorder mask advis assum new mask similar qualiti hope fit previou one comfort howev mail addit outsid packag mail label simpli stuck outsid blue white packag see pictur mean packag mask insid addit dirt mail deliveri system open anoth mask choic go back rate star although previou mask packag,3
eas use,5
dont know realli pli lightweight breath,5
breath without mask touch mouth give extra space skin mask side gap provid better seal narrow face work well wide face may like differ style,5
dislik anyth mask especi like let air side slide nose either perfect coverag light,5
ok,4
comfort previou mask fit realli well,5
mask big disappoint fit well tight larg face open one pack tri fit aw hope refund money unopen pack,1
mask comfort fit well also easi breath,5
small face like would highli recommend husband use mask small,4
qualiti ok band loos dose fit tight face,2
fabric thread inner side mask come easili caus irrit tri coupl issu bad qualiti avoid mask,1
first mask found actual fit face great,4
order pack pull sever wear event today good thing took extra ear loop kept break eventu wore last one ear loop jerri rig extrem disappoint,2
thick light weight cover face well,5
light slide odd nose feel though protect protect other breathabl,5
comfort,5
second time purchas mask comfort feel protect long viru around continu purchas seller,5
cover face exactli right,5
think best mask bought sinc covid start type find comfort trim bit bottom keep push eye buy,5
overal mask seem work great comfort nice fit howev fit girlfriend great tight huge guy tight comfort caution note,4
fit comfort,5
larg head strap somewhat tight ear,5
nice,5
mask seem seal well ear loop way tight adult,4
comfort fit face well afford husband love,5
need problem,5
mask fit well easier breath mani other tri nice fit extra layer protect,5
strap short caus headach back ear hurt realli bad us market,1
excel fit n rate still afford throw away mask love much anyon love wear mask,5
buy check cdc site advis wwdoll fals state niosh approv,1
first time buy mask thin rope short use bye seller hotod make pink mask,2
ear loop short head wife say bare fit,3
fold nice purs alway one,5
cumplen con su funci n son c modo aunqu un poco pequ para alguna persona,5
mask child size return,1
despit identifi made us mask made china clearli shown packag,3
written review,5
tri mani mask tell mani mask realli work fit snugli around face around nose around side cheek wick away wet easi breath insid date best one bought like even better cloth one everyth read better cloth,5
face mask comfort wear made qualiti materi like much,5
best type mask give space mask stick face stay secur,5
great mask comfort durabl feel protect mask flimsi cardboardi either,5
breathabl make feel safer realli cute love color choic alway get compliment mask peopl ask got,5
great mask,5
comfort lightweight provid full coverag,5
perfor mask leav littl safeti,1
make individu wrap,4
ther comfort realli seem job fact came black plu,5
buy sure,5
would great mask hole kinda useless pleas see pictur attach,1
comfort fit size,5
work well comfort wear long last,5
flew hawaii wear mask plane hour mask comfort breathabl husband wore common type mask way realli hard time breath comfort way back wore mask definit felt differ also protect lot better mani layer worth extra money also worn much longer,5
work,5
great fit comfort,5
qualiti product comfort fit well,5
work great,5
pictur wish cushion nose part like n mask past still great buy,5
expect mask give protect variant virus,5
mask appear well made howev could breath know use five layer,1
mask qualiti layer mask use faith buyer mask buy mask time qualiti garbag like pli true layer buy plu price goug mask use tell order mask cut corner meet demand qualiti send pack bought back absolut disappoint disgust,1
unfortun mask slight odor realli bother otherwis fine,2
felt safer wear cloth mask,5
good long plane flight,5
realli great purchas,4
strong feel toward product one way object speak work,5
bought mask use classroom teach overal good mask would buy product like fit snugli slip nose lot talk wear feel protect feel like protect other give star rate bit unpleas odor someth get use,4
ear strap littl tighter lighter weight paper mask wear feel like give protect,5
face mask comfort form fit felt safer travel plane,5
although great product use cours past week notic everi time take day time experienc scratchi sore throat sure allerg materi contain product therefor would like list materi manufactur better understand reaction comfort easi wear lightweight except issu mention read messag manufactur pleas provid list ingredi product use make sensit latex therefor latex product reaction also moment put mask began experi itch around lip face obvious someth contain product agre respons appreci,3
origin order niosh n mask way small even small face uncomfort order differ soft skin comfort wear day layer differ n mask made usa kn mask made china cut one layer effect accord research n mask made usa half price delta variant covid variant way order box see covid pandem go away time soon futur would highli recommend mask,5
smell fabric soften air freshen problem sometim thing come amazon warehous unfortun highli sensit fragranc mask virtual unus also slightli big face problem mask push high nose eye far chin snug fit,3
like fit eas use comfort,5
product purchas month ago market product still look lot thinner definit product decid go cheaper version make sale price definit recommend,1
final receiv mask well worth wait breathabl yet strong stretch perfect,5
good price good deliveri mask fit well stay place constantli pull maskup nose want nose cover would disadvantag kinda defeat wear mask import first place,5
comfort breath love,5
es un poco ajustada pero cumpl su efectividad en el sellado,4
origin order n mask husband fit perfect way small say big head read review order fit much better recommend friend notic price gone consider paid august suppli demand guess,5
like easier ear still seal well,5
great fit great comfort easi usag,5
nice fit effect,5
adjust need,5
bought end pass mask student may need new mask forgot comfort form fit hear complaint,5
order wwdoll kn mask white month ago thrill final find kn mask fit small face comfort provid close fit recommend cdc reorder mask black white receiv august back order mask lot bigger order model number packag mask even stitch outsid materi differ disappoint,2
comfort breathabl mask found work great smoke,5
mask fit well comfort adjust nose piec multipl layer good ordinari activ found bit hot aerob exercis,5
sometim like use mask rigid fit,4
mask seem meet criteria comfort great fit good protect,4
fit great feel like protect better other market,5
comfort easier breath,5
need fit tightli around nose eye,3
safeti purpos,5
seem nice tight fit comfort wear,5
health protect,4
these mask comfort wear long time like flight airplan adjust fog glass interior side soft comfort skin elast hold tight fit tight uncomfort ear need recommend,5
realli thin second buy good first one,2
okay let prefac say kn mask niosh approv respir niosh fda cdc approv author respiratori protect like n bought mask wear glass look like light snug regular surgic mask would less fog well hit miss depend day say comfort durabl,4
comfort effici easier breath mask,5
lightweight good valu howev reason earloop stay place tend slip use,4
see,1
decid upgrad effect mask wear delta even though vaccin want high qualiti mask ear loop strap around back head product fit bill inexpens also lot comfort fit better surgic mask use plu come color,5
tight leav mark cheek,1
comfort get job done,4
went cruis mandatori n mask continu use,5
great mask,4
easi use feel safe,5
none,4
know black pink mask tini ear loop white one longer liter pin ear make look like idiot slip fit never buy,1
far great mask fit face well gap great fit nose wear glass fog preteen daughter tri bit big face plan order kid size hope fit better good comfort feel secur,5
least half mask uncomfort wear right ear loop shorter much tighter left,3
smallfanc name cover much,2
got small adult face head kn mask offer snug fit without ear loop pull tightli get comfort seal around nose cheek chin inner layer soft irrit chin skin like mask tri well craft sturdi,5
mask purchas much thinner fit nearli well return immedi disappoint day ruin,1
like color shape comfort,5
pink favorit color wear mask least wear cute one use standard layer blue mask glass constantli fog pandem get wors fall want someth offer better protect complet prevent glass fog much better mask use almost everi time go someon comment color bought mom like also black white,5
mask comfort strap go around ear soft stretchi fit perfect come chin help hold place hidden bendabl strip bridg nose custom fit best fit close nose mouth littl air pocket insid suck breath feel breath effort fold neatli flat carri pocket purs best mask tri mani,5
mask super comfort zero protect mask fit loos thin perfor held mask light could clearli see hole across entir mask top bottom mask use outdoor event everyon els mask vaccin social distanc option,1
easi breath,4
recommend product,5
titl say well worth price,5
got aunt love,5
fit well hurt ear,5
mask comfort fog glass,5
everi pair mask use thu far metal nois peac fallen thu glass stay fog,2
fix well around face space breath,5
good thing still mask purchas month ago recent mask much thinner previou one like,2
got littl peanut head told tie band make secur around face work fine good level comfort,5
like also black insid,3
dislik mask tight around ear,4
smell toler larg,4
big face,4
fit well comfort mask littl warm happi,5
wwdoll kn mask formerli emerg use list begin pandem although n definit step come protect reusabl packag costli get peac mind travel crowd interior space well worth around,5
great product everyday wear,5
light weight fit comfort easi breath wear,5
nice fit,5
got kid fit decent entir chin area seem stay good fit,4
best fit found leak tight fit uncomfort seem properli seal face without fog glass lightweight comfort deep blue purpl great color alreadi tire tell peopl got,5
littl hard breath,5
work well fast deliveri littl tight around ear stretch bit,5
surpris much comfort cloth mask much lighter easi fold flat ziplock next use,5
mask fit best tri,5
perfect,5
second time bought kn mask seller one even better previou one comfort cover well fold easili talk purs pocket,4
fit well breath better,5
mask excel good valu well made fit perfectli comfort possibl get kn fact certifi import well,5
trade off harder breath surgic mask good protect,3
exactli order,5
work smoki environ take smell smoke,5
boyfriend told mask truli comfort definit get great qualiti money spend,5
shape keep mask mouth wish elast adjust minut minor discomfort new normal right,5
like fit dislik took much longer promis deliv,5
like mask point shape lay right mouth make easier talk breath teach expend lot breath energi class made much easier order,5
took pack trip realli comfort hurt ear occas wear long hour honestli mask bought mask strap would buy,5
easiest mask breath also give protect,5
bought kn read review mask protect variant price good find sinc small face mask perfect twist ear loop tighten adjust loop side mask make secur hope work well,4
one size fit face mask multi layer probabl highli protect good valu overal,3
purchas approv list kn mask work larger face leak air slid eye uncomfort adjust satisfactorili,3
tri definit recommend make dizzi breathabl like claim work,1
mask tri larg fit snugli around face mask fit perfectli comfort would definit recommend,5
fit comfort allow breath,5
love,5
comfort make feel safer enter store,5
best mask purchas protect comfort fog glass fair price,5
wife think harder breath mask other fit good mask seem well made airflow restrict,2
feel littl safe old cloth one,5
like comfort bought teenag son say comfort would buy recommend mask expens mask saw amazon comfort worth,5
order,5
use bunch comfort pull ear keep glass steam minimum easi tuck pocket well,5
airplan travel hot spot around nation,5
comfort day wear,5
mask comfort fit snugli face nose breath well,5
tini woman size fit face well without gap larger peopl may work well wish would get money better surgic mask far fit comfort touch lip talk itchi like surgic mask huge plu,5
black kn much smaller white kn order differ compani black kn littl tighter face nice mask,4
ear strap littl loos,4
without sort government review standard left find safe effect face mask hope effect advertis,4
keep other safe ye fulli vaccin,5
good qualiti materi,5
good valu,5
work great glad got,5
claim made usa packag say made china decept,3
mask rub lip shape realli good nice amount breath room,5
nice fit face glass fog ear loop tight keep come ear stay stretch bit still pull hard back ear,4
like shape mask,2
glass fog wear mask,5
abl scan authent code verifi number pleas fake,5
mask light weight comfort order offic staff everyon pleas fit qualiti mask,5
expect,5
overal like product easier breath thought would like ear loop tight pull stretch wear need wear mask prolong period hour ear hurt overal fit good mayb someon need longer loop,4
work great bought time alreadi buy,5
describ would buy,5
good mask gener use approv mask medic set howev much better surgic style mask singl layer common fabric mask fit well provid good seal review mistakenli though full hole see kn print seam hole layer bond togeth synthet materi place fuse becom transpar sold hole packag came pack,5
easier breath mani mask,5
seal around face test good,4
bought mask protect covid advertis kn ye bag arriv say non medic say protect certain particl misus may lead ill want return,1
protect,5
fit breathabl excel,5
work situat feel addit protect beyond cloth face mask need kn ticket actual much comfort cloth mask offer better protect five layer snug complet fit like black color well,5
definit recommend,5
come highli recommend well made,5
like protect mask provid,5
seem good qualiti mask nurs wear work like better surgic mask feel roomier rub nose easier wear glass nose piec fit snugli enough lessen fog issu,5
easi use fit tini adult husband comfort love keep nose mouth upon inhal speak,5
best found problem one order larg reorder kid size gave brother law,5
gener mask mandatori busi believ fill bill,5
mask fit well,5
use situat space better filtrat enhanc person protect need small store close quarter highli congest space requir usual accordion mask mask well design fabric except ear strap cost adjust strap part mask wider face work fyi work histori confin hazard space access train safe ppe option proper mask essenti mitig pandem,3
feel good cover face good seal side like differ color option,5
happi feel thick fit well feel safe wear buy,5
comfort longer period wear mask seem reason use,5
bought differ brand kn mask ago black pink came individu wrap nice packag cardboard box unlik roomier thicker comfort wear around ear intend buy brand,2
th mask wonder great purchas,5
ear loop adjust tight husband abl use mask comfort mask adult,2
told friend famili member buy face mask truli comfort mask tri pandem,5
bought mask intern trip wear plane europ seem comfort hope protect worn yet still home,5
mask would perfect ear loop stretch unfortun wear hurt ear give headach,2
intend fit comfort flimsi,3
mask complet advertis arriv promis mask structur well provid lot room insid also fit tightli without gap near cheekbon surgic mask use mask shop trip reason short term excurs get uncomfort wear long time wire rim glass get tug elast end long day verg pain accept corollari style glass tightli fit mask,5
pull strap hard come care put work perfect,4
great qualiti protect,5
pink mask took littl extra time come seem work well pleas comfort mask hubbi blue mask fit beard well also comfort,5
love mask one ask smile one ask alway grimac talk anti social reclus dream come true hide contempt mankind simpl black duck mask regret,5
ugh mask better safe sorri great qualiti travel airplan two big citi fit well realli like black look medic recommend highli,5
mask rather long end point render ineffici funni look wear beak,2
return unopen use cloth mask want minim protect shame amazon,1
quit comfort would thought,5
comfort wear good valu,5
use mask go work comfort allow breath room still safe,5
feel protect use black kn mask fit secur come multipack good buy,4
perfect,4
na,5
nd time order breath freeli,5
love fit breath love black color,5
use differ type mask tightest fit comfort,5
realli best n ran across breathabl comfort overal thing strap leav ear sore time definit recommend product healthcar worker,5
easili breath talk see glass first mask fog glass comfort lite wear one good one,5
good fit comfort good valu,5
last n fit perfectli tight around ear wear glass hear aid,5
thought would good covid protect could see light mask investig via cdc niosh determin unaccept,1
easi comfort fit worth invest,5
mask extend work well product big head,5
thought found great find protect mask wait restock order latest shipment differ okay feel flimsi previou order terribl smell realli import also great,3
face fun product necessari fact life day rel comfort well made reason price arriv good condit time,5
arriv time good color good fit definit buy need,5
mask appear well made score cdc test site mask loos around consider big face think mayb bit small nose bridg piec metal provid tight seal better mask bit cushion nose bridg help seal get around use doubl stick tape necessari,3
mask comfort wear least comfort far mask go husband travel work covid right scari feel better mask think order three time,5
mask comfi enough mask definit better qualiti surgic wish put band clip packag kinda loos cheek,4
