x,y
satisfi teacher easili talk mask also feel well protect good fit layer use mask everi day husband howev find fit tight use,5
excel qualiti,5
mask easi posit breath easi shape wish color,5
comfort afford protect mask,5
five star say enough,5
tri mask overwhelm chemic spell smell somewhat like alchohol never gotten mask type smell afraid use return,1
could tell right away better mask contain breath keep small germ viru littl harder breath think effect,5
hard breath total short wear time felt safe,5
comfort lightweight,5
good valu comfort fog glass,5
product met expect,5
kid prefer cloth style said comfort breath easier happi hear caus less stylish,5
comfort heavi materi protect,5
comfort fit,4
product exactli want,5
fit well comfort wear hour time w littl break,5
like put packag five,5
fit comfort feel good around ear,5
mask coat kind nauseat chemic know toxic enough make vomit fume emit mask made china know kind safeti regul govern chemic toxic product also small build mask small face would fit year old,1
comfort lightweight protect,5
well made littl difficult breath nice form materi mask make feel breath minut bought better protect hope work other gonna struggl keep long afraid,4
fit tighter side face blue mask,5
still fog eye glass,4
comfort excel fit vs surgic mask larg,3
like thick dislik know way adjust fit face,3
whole packag everi item,1
comfort,5
good fit tie knot ear loop,5
exactli need,5
feel much safer,5
leav bit breath room,5
mask comfort expect caus less fog glass mask tri,5
pleas mask compar one alreadi anoth sourc mask look pretti much,5
pretti snug initi fit adjust nose clip,4
lightweight,5
bought black pack love make feel alot safer go pubic one worth buy,5
happi suitabl adult mouth move proper coverag entir reason purchas cannot receiv refund exchang grievenc total unhappi seem great upon initi wear tri talk slip nose creep chin caus use hand reposit rend useless want money back,1
love fit comfort breath abil,5
comfort expens,5
great product fit well way fit glass fog realli plu,5
love mask comfort well made,5
mask fit comfort true size good qualiti made mask howev issu mani other went review loop bare know way attach dri rot reappli mask two three time one ear loop pull apart come third pair even day yet bought thought great qualiti could least wear one mask day mayb two disappoint mask come apart pray rest mass fall apart second order mass first order never made anoth compani glad see one made time fashion wear first mask put second third one day discourag go tri anoth brand like said mask well made ear loop problem go tri stapl togeth see get use realli go look weird anybodi know fix problem let know,3
protect offer,5
mani mask one far comfort base design easier carri convers elimin muffl sound certainli buy,5
mask fit well provid greater sens secur,5
seem well made,4
littl small chin larger face great,3
price compet,5
larger head useless uncomfort tight matter much adjust nose band breath vent around nose blast directli eye would return alreadi open packag gave wife fit much better,2
thank avail protect,5
mask light fit well,5
mask great much less eyeglass fog adjust top nose,5
like comfort mask tight enough feel protect could spend whole day rel eas,5
good comfort fit gap light weight bridg nose section form face easili,5
gave room breath,5
elast littl tight ear,5
like,5
still hard inhal fold nice,5
wait search patient qualiti mask protect medic expert recommend everyon resort doubl mask stop use unreli cloth mask kn mask extrem necessari make thing much safer pandem sincer believ whether health profession work front line everyon afford protect order control spread infect best possibl first step end person practic protect one self mean qualiti mask util continu hand wash social distanc must also observ without except also believ even one fortun enough receiv covid vaccin shot precautionari practic continu matter,5
suitabl need,5
got exactli look,5
wish larger,5
mask littl small larg face easi breath strap could longer fit snuggli,5
comfort construct,5
everyth perfect,5
mask small ear strap short stay hold face hard breath,1
like fda approv emerg use,5
fit good face gap goe glass fog,5
comfort mask easi breath would recommend anyon,5
like fit bit around top mask kind rough face wish softer,5
issu,5
comfort difficult wear long period time good fit around adjust nose piec better fit,5
profession made qualiti mask,5
like everyth mask lightweight fit secur gap breath wear mask recommend mani doctor spoken,5
breathabl comfort fit well fit small face fda approv check,5
worn hour condens develop insid,5
comfort fit good space around nose feel much safer mask believ around us safer,5
school teacher struggl variou mask uncomfort mask fit realli well comfort glad purchas expens worth,5
realli nice fit mask,5
could adjust ear tab,5
happi qualiti fit,5
comfort style,5
catch covid mask suck,5
good qualiti mask first seem difficult breath adjust work well,5
fit,5
confid product provid accept protect would recommend purchas contact covid dilig usag product,1
comfort excel materi,5
good fit receiv mask need timeto check,4
feel safer mask good qualiti would order,5
mask comfort fog glass,5
comfort mask worn layer give peac mind,5
good product wide face littl tight ear,5
like comfort,5
light snug clever design keep shape away nose mouth four layer metal insert bend match nose shape sturdi ear strap keep mask place airtight enough flex slightli breath thin enough littl resist altogeth best mask tri supposedli meet eu us standard filtrat,5
nice fit good protect littl hard breath keep heat insid mask somewhat,5
easier wear great fit doubl mask safe mask still comfort mask choos kn mask loop ear one step n imposs get,5
fit well pleas product,5
mask cover mom face perfectli dispos mask provid much protect also design mask made much easier fir mom breath,5
n mask comfort cover area face import,5
mask,5
fit well,3
love,5
love much like presid biden,5
mask big disappoint small like child size well extrem tight ear loop lengthen adjust order kn definit poorli size,1
like comfort perfect size fit,4
good snug fit,5
bit muffl talk otherwis great product,5
fit face perfectli,5
fine product,5
mask comfort breathabl,5
tri coupl comfort well fairli easi breath good price deliv promis,5
mask fine except elast band bit short lengthen way,3
hope product give better protect cloth mask use well made fit tight comfort wear,5
mask far small fit properli tri wear one breath entir hole bottom mask chin make mask pointless better serv properli fit cloth mask,1
help packag separ pack mask initi strong odor origin open air mask day allow worn,4
thought fit would glass still fog,3
great fit comfort,5
awesom,5
comfort wear especi behind ear,5
great,5
qualiti cost,5
like problem pull ear forward,4
stretch much even last hour wear,2
take bit get use worth peac mind,4
mask necess covid pandem pack group five know need,5
first mask broke within min fist wear,1
stink sit sun hope smell go away made china think smell must beij smell like,1
seem like good qualiti mask,5
love mask lightweight comfort stretch,5
mask hang loos face use plastic strap fit tightli think best use way wish shape cone,5
thank,5
mask fit correctli escap fog glass matter adjust mask breath comfort mask disappoint wast money,1
amveri sastifi mask two test find good pass test test put water see link bad one link blow candl lighter pass test feel happi find mask pass test recent bought differ mask fail test return,5
seem caus less fog glass,5
feel like provid protect great thing covid around us,5
fit face well glass fog air escap around nose,3
love nice fit mask,5
seem trick could test shop see sawdust,5
lightweight comfort wear thin one layer decor mask ad protect,5
mask comfort fit perfect,5
lightweight easi breath fog wear glass sure safer mask fit better give space breath,5
wonder want realli good face ask wear long period time final got one fi gre,5
poorli construct,2
mask fit snugli smaller face seal well feel safe wear leav indent skin around edg wish littl bigger fit husband qualiti good ear loop seem secur attach,4
mask air hole definit see sure protect anyth may well put hand mouth wear mask absolut worthless also way expens,1
want expect n mask,5
elast band caus discomfort behind ear twist misplac,5
like qualiti mask sturdi durabl,5
mask feel comfort time protect,5
kn work great even put plastic frame reusabl mask daili use mask enough space worn comfort enough breath fold nice,5
satisfi product,5
decid mask game near futur snug breathabl comfort pricey worth,5
fit well,5
comfort long period time hour time travel outsid etc stretchabl need plu look cool,5
fit husband perfectli,5
week like mask thicker littl blue one wear fit great snug fit make feel safer groceri store still breath okay peopl hear talk glad bought n mask,5
god qualiti nice comfort,5
high qualiti n mask happi better suit smaller face,5
found mask work well nd mask place normal pli mask first place kn mask provid good seal facial hair,4
expect,5
product arriv right time fit great light weight comfort,5
mask well fit comfort,5
like gener size ear strap bother much better wear,5
work well,5
good buy buck,5
fit snug air leakag around nose area certainli better standard blue mask air flow notic lower got use pretti quickli want wear work seem legit,4
pleas order find got,5
great mask,5
best face mask found,5
feel secur around nose,5
excel,5
use work fit better mask lightweight,5
bigger guy small head size,1
covid protect well could softer would comfort howev long protect covid happi clam know big wide grin,4
fit well comfort,5
order husband also order law like complaint difficulti doubl mask loop around ear come easili tri doubl mask good law like mother tri like order famili member,5
could breath much better cloth mask comfort light weight,5
nice fit easi breath fit men women,5
face mask perfect happi purchas order addit fit snug face allow breath minim need adjust convers excel purchas,5
breathabl light good qualiti,5
ear band cut ear,4
earli seem fine,5
great fit comfort,5
good qualiti mask gotten covid yet help,3
good deliveri,5
sure truli covid safe packag vagu disclaim product may help prevent spread viru care purchas ppe countri china safeti standard us,3
fit like regular mask depend tight may want face one want suction tight feel want breathabl comfort durabl mask want,5
qualiti decent small way design make almost ineffect,1
mask cover face well fit well elast tight wear less hour back ear hurt better short term use,5
scratchi uncomfort,1
best,5
fit well tight enough feel safe,5
love mask fit great comfort,5
great mask quick deliveri,5
adult size unless freakishli small head mask tight creat maximum strain ear bare cover chin,1
fit better cloth mask tri fog glass badli mask,5
comfort,5
band short head smaller averag adult,1
comfort,5
wish bought better price want return mask,4
effect protect,5
breath easier,5
narrow face big nose high bridg adjust fit comfort other famili complain though cover face eye well chin overal size good pinchi around nose still make use,4
fit face perfectli nose clip sturdi make nice seal exhal blow eye would buy,5
type kn mask step regular dispos mask packag nice five pack five mask first thing notic much tightli mask fit face regular mask purpos mask first place fold put pocket kn type mask make look littl duck like seem make littl easier breath satisfi,5
good fit breath easili receiv time,5
like tri sever mask shape far comfort fit secur tightli allow still breath would highli recommend,5
awesom order n mask strap go head neck go ear worn outsid work well,5
excel,5
great qualiti highli recommend,5
comfort n mask strap comfort around ear,5
big,4
mask small seal well around top nose,1
stay away mouth stay dri comfort,5
well product receiv use,5
good,5
nice yet littl small,4
comfort space within mask,5
much better fit cloth easier breath thicker,5
tight fit,2
kn made well find ear loop bit tight stretch elast loop bit put mask fit well,5
felt better,4
comfort thicker mask,5
comfort easier breath mask feel protect,5
terribl nosepiec broke second wear,1
fold flat good wallet travel,5
everyth mask good issu elast littl strong tight probabl big head,5
like snug fit comfort,5
mask sturdi comfort think could wear work day,5
husband think safest option famili,5
mask fit well arriv quickli,5
realli like mask give room breath extend cone mask allow least feel like breath better run exert lot harder grasp much air fast feel well protect kn mask much comfort cloth mask medic paper type blue mask,5
much better cloth one wear fit around face well,5
glass still fog supposedli relat fit good seal frustrat like get lip irrit mask plan wear work travel cloth mask top pandem,4
wore hour comfort issu cours noot know effect yet day sinc event,5
light weight breathabl,5
comfort,5
work great,5
job,5
nice made breathabl,5
problem would given star total medic type smell take packag hang somewher day goe away otherwis comfort much easier breath definit feel littl snug around face bam,4
goof,5
satisfi,5
mask comfort wear extend period time easi breath get short breath like suction toward face breath limit air get,5
mask cover face well conform contour around nose chin pinch nose wire prevent fog wear glass comfort wear extend period work well mask cloth mask maximum protect,5
noth dislik lightweight fit face perfectli easi breath,5
everyth mask good problem,5
edg mask rough scratch face,1
k mask fit firmli tight breath easier,5
softer version work blue one fit tighter though cloth face mask want cloth mask health issu hous take precaut,5
great fit good seal around nose reinforc allow tight fit minim leakag exhal prevent fog glass confirm manufactur list fda site approv emerg use n standard kn equival us n filtrat standard get littl warm moder exert order white black color black color visual appeal person prefer well packag deliv ahead schedul,5
think want light weight stretch want firm face work healthcar need thank,5
great protect littl tight would outstand strap adjust,5
fit right fold away nice,5
cumpl con mi exigencia,4
fit perfect,4
want start doubl mask thought mask combin one blue mask would trick mask ok doubl mask ivegon back origin blue surgic mask comfort mask alon mask combin anoth mask,5
pleas mask larg face fit well tight enough glass fog also lightweight yet feel plenti thick enough protect,5
love mask one wear right bit pricey mask pay qualiti promis lab result ador filter effici five layer extra space give mask signatur duck face look also make feel breathabl nosepiec easi use mask mold shape face wear ear band put much pressur ear irrit recommend stretch one bit use use mask school store even ran time typic replac week use coupl time per week depend often use use highli recommend mask give shot,5
claustrophob feel happi,5
use mask first layer follow cloth paper mask cdc recommend prevent contract covid viru,5
like everyth dislik noth,5
excel face cover,5
fit face perfectli ear piec comfort also feel provid good protect help necessari errand,5
clean comfort fit breathabl,5
felt comfort,5
great excel qualiti,5
solid,5
mask fit snug comfort lightweight follow guidelin safeti,5
kn mask fir easili face allow speak clearli make easier understood mask came pack mask total mask packag would order mask,5
wear mask travel airlin well made,5
realli glad order glass fog much cloth mask thumb,5
mask want,5
rough nose,3
love mask glass fog,5
work great feel safe,5
first time use n face mask person protect covid actual use time one blue surgic mask extra protect got use n problem definit feel huge differ breath airflow sure black look stellar,5
comfort,5
use product protect covid face mask comfort breathabl,5
provid excel fit comfort,4
seem good use yet,5
comfort secur,5
mask fit well seem effect like layer,5
like,2
good fit comfort pleas,5
mask fit snugli comfort slip like mask,5
felt safer mask other,5
su tamano es pequeno,3
mask good fit well made,5
use person protect,4
fit well air gap,1
mask comfort fit secur,5
secur fit comfort,5
mask excel comfort fit nice,5
well made item wife tri blow candl test pass get warm hot mask given level expect,5
small head still small tight littl face,2
hat size beard kn fit snug snug bend ear best review give buy,5
make good seal around face easier breath cloth mask bought second packag,5
larg,3
mask lol work well,5
perfect fit,5
deliv time exactli describ realli like mask feel well made secur surprisingli breathabl kid good true n cloth mask help seal even tighter clear shield feel pretti darn safe,5
seem legit like nose piec materi,5
seem protect breath easili,5
excel fit comfort great valu,5
issu elast bother ear wear day student say look like duck quack quack,4
comfort,5
well made comfort,5
harder breath expect,3
fit tightli face minim fog glass,5
great,5
absolut favorit mask heard expert yesterday say n kn doubl mask necessari fit snugli face think give better protect second order,5
find much easier breath mask other tri fit face secur make feel safe comfort wear,5
layer import warm wear,4
everyth good issu initi odor mask,4
mask feel light comfort breathabl,5
like everyth except adjust ear loop fact fold mask put pocket great,4
great mask state gone doubl mask wear kn doubl layer cloth mask work great comfort lightweight,5
realli love way shape face elast ear loop way short idea skimp except save money best go longer put loop peopl would abl use whether small larg face tight husband ear pull forward look like alien lol mess realli nice product like pull see stretch pop easili glu back hot glue close edg hot glue stay matter far pull way comfort give star overal,4
ok fit could better,4
good product could littl comfort,5
expect,5
mask amaz comfort cover nose mouth nice highli recommend,5
good qualiti black nice chang,5
fit perfectli good seal around nose mouth lightweight seem breathabl good mask,5
good,5
best dispos mask tri accord literatur mask test good replac n mask need ensur one buy fda approv list find comfort mask tri construct mask touch along the seal edg leav end nose lip untouch interior open space also far fog glass rare temporari event,5
littl snug definit feel protect leav hous,4
fine mask note kn rather n necessarili issu gener use public,4
good fit face minim leakag,5
mask doctor appoint,4
decept product basic fake n mask other use protect coronaviru seller intend deceiv buyer name mask kn,1
gener care way n mask look order much comfort protect cloth mask happi purchas receiv order realli quickli,5
comfort keep glass fog,5
good valu,5
qualiti seem fine way tight around ear band stretch hurt larger individu consid say larger mean fat man larger build size,4
like way fit snuggli,5
band strip make uncomfort,4
fda approv realli say cdc approv manufactur list approv websit,1
satisfi kn face mask provid seller bjcroffici strang time reassur abl keep other oneself safe thank,5
fit well comfort feel protect especi pair surgic mask use protect measur covid,5
easier breath mask,5
fyi mask certifi niosh pandem mask certifi find pack certifi niosh amazon similar statement,3
abl pinch nose area make fit snugli wore hour run errand never got hot alreadi recommend famili friend,5
averag size head adult male ear loop strap short caus ear fold minut get quit pain could imagin wear day especi someon larger head,2
mask true n thu fals advertis report site,1
use go dmv food shop wore black fabric one underneath felt safer,5
good fit structur reli vendor filter advertis,4
like,5
everyth list,5
fit great comfort buy,5
awesom,5
problem ear strap type mask,4
give excel protect abl wear mask glass without themfog abl breath much better compar blue mask color isgood got pink much attract black,5
lightweight mask breathabl fit good littl gap,4
uncomfort tight lb,1
fake buy follow cnn link cdc websit diagram offer real n niosh approv mask miss great deal inform even close present print mask,1
sure fabric good drawback make unus nose bridg minim seal air surg upward toward eye breath even tickl eye lash uncomfort small size even tight skinni gf smaller averag face,2
sure way determin real kn five layer fit great tri blow mask blow flame would definit buy,5
fit well effect,5
sure exactli effect fit snuggli pliabl chines kn american n read close equival,5
good,5
comfort,5
happi purchas,5
good product cdc certif plu comfort good tight fit breath leakag issu,5
decent mask legitim kn mask approv cdc niosh,3
could cover littl side,5
includ niosh approv safeti label,3
face mask think would use stupid question,5
rel inexpens fit subpar mask cut small metal use shape nosepiec weak result extend firmli enough chin secur gap around nose ok pinch need speak wear one find fiddl mask keep place buy,3
feel mask could littl bigger,5
feel cover nose mouth properli form good barrier better cloth mask,4
fit,1
mask fit ok seem get glass steam howev idea effect suppos tend pull husband ear forward look strang,5
excel product comfort wear use best mask use,5
face mask uncomfort,5
comfort fit snug help fog glass,5
good describ ship fast pleas,5
mask fit comfort secur face longer period time,5
mask true n awar time order true n ear loop true n serial number lot number also two elast band go head ear cost fake mask high real deal,5
fake kn,1
great mask fit snug face wife pleas sinc pack seper individu pack mask read thay mask may reus time depend wore disinfect spray use go outsid shop walk around spray let dri use time,5
approv n mask,1
thk,4
fast deliveri best good qualiti,5
elast short caus pain ear worn realli feel take leav glass shop fog time mask seem effect definit cotton ear pain poor bridg nose fit ye cours bent metal strip best fit make think seek anoth model,3
corona safeti,5
see mask elast attach,1
bought mask saw peopl wear plane fli look high tech comfort bought everyth state packag far comfort fold nice fit pocket,5
arriv time product describ,5
love come prepackag love color comfort easi adjust tight ear worn extend amount time yet speak far great,5
good around mask fit close face,5
great secur fit slightli duck bill front protrud bit worth feel suffoc order white black color twenti someth son prefer black,5
suggest mask anyth like true n mask mislead hoax thin junki uncomfort aroma eye began burn wear one minut recommend,1
daughter stretch ear loop coupl time better fit,5
love,5
wear public look good slip,4
although mask well built cut almost air breath way could wear full time know sign time realli want mask protect breath,3
extra protect,5
small face,5
due strong chemic odor mask discard,1
great price,5
fit good smaller face well larger person,5
good mask comfort except tri talk wish came larger size,3
niosha certifi,4
sure feel like offer good tight fit mask,5
best featur shape stay away face less fog glass,5
purchas think better job filter viru simpl cloth mask use month like provid better still perfect seal around mouth nose cloth mask like point sit right mouth,5
mask tight face,4
super comfort fog glass,5
good product,5
want someth fit face better provid protect time watch variant fit bill light roomi squish nose stuck close face fog glass still problem still look solut elast ear littl tighter would like price pay snugger fit,5
nice made much nicer light blue paper one,5
fit great wife love,5
like mask easi breath problem elast mask eye glass make behind ear sore,4
product appear high qualiti arriv quickli lack way adjust strap know need good deal tie knot strap make tighter male take size hat strap big enough,5
need differ size great see shape individu face well believ return kind item work,5
may phoni n niosh approv seal head band,2
sinc cup shape sit tight nose seem leav littl extra breath space wear mask long comment wear long space time,5
comfort,5
hhjjhhhhhhh,5
excel qualiti mask got black pleas,5
small like give mask better trial want say mask fit well get use tight ear loop hold mask firmli face,5
mask pain behind ear,1
standard mask,5
small face need pull loop behind neck clip,4
cover face well,5
leav home go offic hour,5
easi breath,5
love mash fit great would buy,5
covid protect receiv time fashion,5
comfort,5
like item,5
like color black stape mask sthin fragil leav mark onmi face disappoint cheapli made tini mask,1
exactli need comfort lightweight,5
size fit like larg fit left gap chin face fit medium size might work truli larg face med sm nose bridg great due fold center mask workabl,3
unhappi find even though packag say layer actual mask one meltblown layer wear around check pleas ignor appar lack qualiti cut open check kn layer recommend worn covid use layer,1
great mask hardli exhal leak,5
straight garbag toilet paper better job get rip,1
mask small man loop kept come ear,3
tri mani mask past conclud like kn face book best protect comfort wear long period time recommend friend plan mask around long time yet thank great mask product,5
like,4
comfort face mask light weight,4
nice mask rest right mouth,5
mask fit realli tide ear strap give wast,3
light weight best fit far could stretch bit around ear appar big head,5
comfort,5
like fit could bit larger best qualiti mask purchas could inform long worn chang new one clean,5
lightweight easi breath cover main part great,5
mask necessari item discomfort unnotic,5
bought use face mask pandem pleasantli surpris find well made cover face snugli without compromis breathabl,5
quit comfort knit mask tuck chin better stay place better feel protect mask,5
gener daili use,4
item advertis,5
fit face well feel hospit ppe,5
light weight lot space insid,5
great qualiti,5
cant bresth,3
great fit comfort,5
thank,4
best mask sinc begin pandem,5
mask ordinari surgic mask order,1
pretti decent comfort,4
fit great comfort,5
good fit,5
materi seem good howev mask small provid good facial fit strap behind ear inadequ felt air circul inward around mask tighten paramount get mask,1
mask fit well feel protect would def buy thx,5
mask difficult breath,3
