x,y
la verdad que solo es molesto ya que pica mucho la nariz al detallar la part interna mucha fibra del materi suelta causo mucha alergia,2
elast ear stretch quickli small face use time mask fall otherwis pleas,5
great valu price,5
product meet need comfort protect excel price,4
mask move slip face much secur fit face,4
mask oil gasolin smell first open packag shake air sever minut befor put make wonder safe wear happi,3
ear loop hard fit difficult stay,3
comfort feel sturdi fog glass,5
great mask,5
fit well ok within limit real n mask like strong chemic smell put leav mask open car seat exampl odor goe away day,3
well,5
great madk fit perfect thicknesd want bulki fit husband well even though small face,5
great price fast ship good coverag recommend,5
good feel safe,5
seem well made proper cdc list use three layer cloth mask ppm filter doubl safeti concern though step outsid door kn fume neighbor idl diesel truck gass hope one particul suppos block,5
bought mask differ supplier use suffoc measur x saw advertis x witch perfect bread space exactli size x,1
good kn mask purchas amazon strang fit front get good seal around face,2
wear mask hour day mask comfort allow breath,5
look kn mask feel secur pandem fit bill great valu money seem sturdi leav hang care use,5
short get good seal particularli around eye whenev breath feel jet air blast eye fog glass factor make incred uncomfort otherwis seem pretti good fabric littl rough abras breath fine definit tell thick fact flex breath,3
see written dozen hole punch thought first well look outsid mask bright light see hole actual heat weld seam reflect light solid heat weld area transpar appear hole hole mask comfort pass air nearli well use especi moldex n mask seal well around nose anyway suck tight face breath say good typic dispos medic type mask lot peopl wear seem accept reduc risk contract bug realli seal around perimet filter medium restrict air air slip perimet thu unfilt would wear around seriou risk area construct tri filter drywal dust fiberglass dust etc person doubt meet usa n specif,3
dislik fit mask tight size larg,1
comfort,5
recommend consum lab com excel protect,5
covid must work,5
fit small face well,5
fit nice fast ship,5
felt great felt protect,5
although comfort feel mask need fit snugli nose mouth,4
excelent lo volver comprar,5
thick comfort,5
good qualiti,5
excel madk,5
elast strap short comfort go around ear mask small without enough coverag except small face,2
great,5
mask decent like talk feel mask rub lip eat loop smaller size husband feel like tight also mention loop also break pretti often like use week time especi price point constantli break abl like look replac run,3
good mask fit tighter surgic mask use covid told import strap fit tighter ear requir second two extra adjust worth effort five layer tighter fit,5
good fit nice mask color,5
comfort work well,5
exactli order came time,5
excel advertis,5
tight fit loop ear provid good seal though enough air escap sunglass glass still fog bit take get use harder breath surgic cotton mask larger head may work give bit headach wear awhil still wearabl make us feel safer layer surgic cotton mask hole review point hole air escap get mere heat seal area creat manufactur process worri tri may stay well,4
smell need air time,3
great product frontlin nurs worn n put fulli vaccin chose mask purchas anoth rn recommend comfort,5
love fit comfort breath abil kn face mask use mask doubl mask wear cloth face mask shape give space around nose snd mouth easier breath highli recommend face mask whether alon anoth mask,5
mask fit great tight around face howev tight fit around mouth nose difficult breath kn mask oppos dispos surgic mask look mask go seal good tight maximum protect mask job,4
way easier breath get good seal glass fog much drawback edg scratchi buy,5
huge head wear ten hour day mandatori better cotton,5
mask work well wish china like spend dollar us compani fit well enough get bit sweati,4
overal good,5
great mask fall fit around ear well iam abl breath nice work childcar keep lil one safe well mask perfect,5
eyeglass fog result proper comfort fit mask offer,5
love could breath better,5
super comfort great fit earloop stretch great purchas,5
like mask close mouth nose breath better like mask still fog glass matter press clamp nose use mask run errand go visit mom,5
found fda approv list list manufactur kn mask chengd technolog comfort husband wear,5
thin around poor fit hard believ contain cotton disappoint mostli fals advertis made china usa,1
pleas find kn mask favorit color pink fit comfort also love fact easili fold put purs store cone coffe filter weird smell bought other shop show rest assur buy need thank ms christi,5
like layer featur mask nice firm comfort fit around mouth nose best featur cup like fold gave breath room mask would definit buy product,5
awesom keep go back buy,5
mask great worn short period time ear loop stretch comfort thought would product good would recommend get mask comfort ear loop wear hour,3
comfort steam glass question reusabl,5
excel product,5
breath easi even exercis,5
wear hr felt next day good hr,5
would return past return date,1
breath fit tightli,5
good fitstudi construct,5
best mask bought,5
mask give one secur feel fit snugli nose clip ad protect thick wear glass mask fog problem mask comfort feel mask especi creat intend purchas,5
comfort,5
work stamp shop need dark color mask work well,5
love comfort fit work mani client drug addict sever mental health problem feel safe wear mask sinc offer layer protect wear mask purchas mask great qualiti comfort,5
littl small face,3
best one,1
arriv time good product well made,4
superb,5
order mask usa ny govern advis peopl doubl mask mani cloth mask mani style mask recommend want mask metal band secur nose trick fit femal face fine properli reach husband chin still use doubl mask like nose band,5
realli well construct fit great excel filter good valu recommend,5
make good seal would tough use strenuou activ sign real kn mask,5
comfort,5
comfort around area skin,1
product feel safe protect go public place lot peopl extend nose piec allow easier breath right nose like mask good mask buy,5
fit properli nose wire thin tini bend seal properli direct everi breath directli eye cant see hold pinch bridg nose mask seal wire thin tini thing,1
great fit breathabl initi chemic smell breath take day go away let set sever day use,3
great fit,5
issu wear long time breath easi,5
nice packag,5
protrud far face would prefer flat n mask,5
good qualiti littl big face feel secur great product,5
fit well gap around face except bridg nose,1
comfort cloth mask wear day comfort war mask,5
good mask good price,5
good fit around face felt safe use mask,4
comfort fit breath without problem,4
mask bit small face uncomfort ear strap pull ear could adjust cannot recommend product,3
secur abl breath well fit well face,5
comfort form good seal face easi breath good purchas,5
easi breath fiber itch face,5
great product need wear hour start hurt ear mask strap slightli short neg thing,4
amaz mask made mani past year yet fit best floppi ear seal perfect medic recommend give sever yo friend one made medic friend,5
nice,5
good mask main issu larger face bridg nose chin fit snugli creat good seal comfort wear work maintain seal mask use wear armor l xl face mask size refer,3
like thick mask fit,5
believ best mask mani surgic fabric mask feel safest one compar n mask,5
everyth mask recommend extrem comfort realli notic snug fit appear adequ thick absolut favorit qualiti posit correctli absolut fog glass went groceri store yesterday got back car drove home realiz still mask drove garag,5
mask fit well easi breath despit thick seem give protect surgic mask other hear talk import work,4
good fit averag size face comfort wear,5
love protect feel uncomfort wear feel stylish use,5
appear seem rigid,3
definit could blow flame lighter wear kn still fog glass expect work,4
fit thick color perfect thx,5
order black mask sinc cheaper go everyth effect work person remot need someth reliabl thick enough comfort wear day long realli like mask even need adjust elast mask cover everyth realli well comfort enough wear day use daili week satisfi product think order,5
secur fit mask comfort,5
put dab essenti oil insid smell like chemic,4
keep good work,5
safeti,5
impress qualiti product clearli mark kn fit well comfort,5
fit best,5
excel fit comfort high qualiti,5
design,5
good,5
sturdi thick comfort,5
mask littl discomfort around ear wear,5
say mask mask wear mask one pretti good arriv quickli good condit,5
good mask look better white one,5
mask smaller expect check see children say tight fit pinch face small face,3
fit secur comfort feel substanti,5
feel better hospit mask,5
well construct bit larg smaller person upper edg mask come right edg eye,5
qualiti mask,5
like thies order mask mask open bag mask need send mask let know happen,3
say made usa receiv say manufactur china would purchas known mislead,2
mask approv,2
feel complet wear mask cloth mask test recommend pass,5
love feel littl loos top nose,4
tri hand differ dispos mask usual disappoint least one aspect time absolut perfect fit wonder wear day pressur ear feel like kitten hug face among hand china fda actual approv definit purchas,5
mask great easi breath comfort fit great thank keep us safe,5
realli wish ear loop comfort stretchabl also happi odor insid line,3
excel secur fit,5
pleas fit,5
size medium comfort adult male,4
good valu sturdi mask,5
realli nice mask small mayb kid wear return,1
second order share one friend need order soon pleasur share truli wonder comfort yet give good coverag love friend,5
glass get fog wear mask,5
love overal qualiti mask buy,5
best mask seen far,5
great comfort,5
sure neg review found mask fit well leak well construct comfort wear,5
item exactli advertis,5
smallish side bigger face leak,2
comfort easi adjust fit well,5
fit tightli thu useless would like refund,1
advertis k suppos safe layer fit tight,1
mask thick breathabl feel safe,5
real n googl real one look like decept,1
mask perform seller indic websit,5
individu wrap wrap quantiti packag bag say individu wrap purchas team share one want touch packag peopl touch realli streach open open far face cover entir mouth nose,4
great mask much better blue surgic mask much higher qualiti smaller fit better seal much better thicker layer claim far effect littl harder get air filter better,5
comfort also better fit face pleas would recommend highli,5
qualiti expect use anoth mask need,3
n,5
thank product describ,5
got reaction face use mask,1
fit snug feel comfort describ,5
like feel fit,5
fit good,5
mask covid,5
mask wonder ear strap bit short hurt ear short period affect rate comfort stretch lengthen strap quarter inch would five star mask strap alway shorten lengthen teacher mask stay hour time ear comfort mandatori,4
good comfort,5
comfort thick stretch qualiti look pleas,1
good product thing ribbon littl short must stretch use otherwis good,5
work great good fit wear time,5
great mask wear day school,5
issu oder leav packag open day mask better,4
comfort breatheabl,5
complaint,5
larg larg run small,2
mask poorli produc smaller standard kn mask properli creat seal around face,1
well made comfort wear day great fit protect,5
best kn mask well made excel fit breathabl,5
work well abl reus issu,5
mask littl uncomfort behind ear need littl stretch would recommend,4
fit well come nose easili mask use go store shop mall place around peopl feel pli give greater protect,5
love,5
need black mask work well felt protect,5
real issu w mask odor need air awhil wear fact odor make wonder breath toxin,4
protecci n comodidad,5
item fine bit long face find touch eye bit annoy pull bit nose fine,4
feel confid protect mask,5
fit larger face quit hard breath kid wear,2
like thick color comfort,5
buy unless enjoy look like duck mouthpiec extend outward would perfect fit deform mouth protrud inch face,1
fit good also fit husband lb job,5
like mask style comfort think could fit littl tighter tend slip talk mayb put knot elast ear loop,5
mask seem like good qualiti small bare cover face say adult size mask children size big person big face wear mask evan tri talk chin come bottom mask mislead adult size packag,3
feel safe mask,4
yo son return school want home prepar protect,5
mask fit great easi wear,5
like way mask fit face sinc use protect,5
pleas trust like comfort feel mask irrit use mask hour day day week face friendli disappoint,5
mask fit snug face leav room around mouth lip,4
comfort,5
love mask buy,5
nose piec littl loos ear loop otherwis excel rate b,4
comfort,5
happi fit mask feel safer previou one,5
breath difficulti mask make much easier,5
product good definit price ebay cost,3
work place,5
order one pack mask white anoth pack black thick fine howev fold packag creas middl notic could feel air leak bottom chin breath creas imposs get good seal comfort use mask believ air escap also breath area mask also fit bit tight coupl time wore would stretch elast band time leav mark face purchas wast money consid bought two pack use three mask total,4
lightweight comfort good seal happi purchas,5
product well made almost shame singl use,5
sure work mask go comfort well construct kind cute mask use go mask work best talk move wish made color guess lbd,5
fit perfect glass fog,5
mask smell bad cannot wear feel inhal toxic fume whole time want tri return,2
realli like kitchen mat comfort mat came big size mat made edg mat stick creat trip hazard,3
like kn mask wear want howev larg fine small husband keep push disappoint,3
offer comfort layer mask protect,5
thought would black insid difficult glass glass fog use mask wear plane get covid think protect comfortbal,4
good servic good probuct,5
safe mask,5
make breath easier blue mask bought earlier,4
like comfort fit properli face,5
comfort easier get breath,5
like fact provid maximum safeti like wear mask,5
kinda thick conform well,4
far superior cloth lighter dispos mask fit tightli around face yet leav airspac around nose husband face larg mine small adapt size seem much easier breath mask hold well also,5
small adult man lbspoor fit gap around,1
substanti feel mask flimsi seem like thin cloth materi,5
overal okay littl small men insid fabric littl tough,4
comfort easi wear,5
product fit comfort big face recommend seal around nose well enough stretch attach hook around back head,5
good stretch fit well,5
mask small use children someon petit figur talk make mask danger basic useless seem qualiti thick mean anyth fit face small dog,3
comfort great seal,1
fit well reason comfort filter perform advertis winner,5
comfort fit fol ear mani mask bought extra packag give packag immedi extend famili member like comfort fit,4
face mask,5
mask fit like glove think get protect wife face littl smaller lot type say look lot caus mask touch eye comfort,5
order mask wear two mask ask us mask layer mask much better mask wear therefor secur comfort abl breath give star glass still fog even though metal bridg nose squeez close nose time glass still fog great mask wear mask,4
dislik size small face look ridicul face,3
upgrad cloth mask seal tight around face bend upper nose clip snug fit mask goe slightli chin seal throat slight stiff allow snout creat space mouth move insid mask,5
comfort wear feel protect well,5
nice mask larg,3
got mask extra protect glad chose get kn mask fit face realli well appreci pinch tighter nose also love ear loop tight ear caus discomfort like mask also tell filter inhal mask move breath mask make hard breath least definit recommend,4
fit face perfectli definit reduc fog glass need wear mask wear one friend agre comfort think depend far back ear sit side head mayb dimention face make elast tight,5
awesom product good qualiti,5
good fit comfort,5
perfect fit function thank,5
perfect order worth everi dime,5
maximum protect gap,5
super comfort breathabl ear loop pull wear day speak clearli,5
mask form sort cup mouth nose like materi touchyour mouth stay put fit tightli chin nose take cangrab middl pull free elast ear,5
seem like good qualiti mask wish littl bit larger,3
snug fit good mask way shape make bird beak unattract wear work pass need profession set,3
noth,5
think problem wear one first time throat irrit felt like could tast fiber tongu feel lung person think safe wear sinc tri mask packag effect mayb addit layer materi think imagin wear,1
comfort wear seem seal quit nice around face,5
fit perfect adult,5
mask fit well provid protect also comfort comfort mask,5
receiv product quickli love comfort fit highli recommend product,5
around great mask comfort breath well talk without mouth touch mask,5
good qualiti product,4
love fact layer mask fit comfort mouth nose design allow breath mask thru mask make lot easier breath wear,5
high qualiti effect quit comfort need get particular,5
great mask u look like bird safe bird nonetheless,5
effect comfort mask anywher effect layer fit tight face uncomfort tight importantli sit away mouth make much easier breath,5
excel qualiti fast ship good protect,5
like fit color,5
love qualiti light sometim forgot even wear mask,5
na,4
sure howev great fit husband,5
fit perfectli feel safer,5
work good,5
fit expect comfort,5
like although strap secur enough sometim brake,5
comfort enough fit well face talk ok mask slight chemic smell like also way know actual filter germ,3
thought mask would thicker sinc suppos five layer thick,5
like durabl howev believ manufactur goug due pandem,4
good fit easili adjust metal portion nose one mask pass fit test suck air mask collaps onto face tri mask suck air mask sit leak properli protect,5
wear hurt ear comfort breath initi thought pli review inde pli give star,4
wonder product,5
seem effect comfort mask need air bit prior usag,5
great tight fit fog sunglass,5
loop short band break,3
mask earn hubbi approv moment tri one like easili breathabl fit comfort face,5
comfort better brand tri,5
live advertis,5
littl tight ear feel ok foggi glass,5
color comfort,5
fit comfort,5
well made fit well design feel much safer tradit surgic mask,5
fit,3
best mask year covid,5
hate wear mask feel one protect better cloth mask lightweight easi breath,5
love comfort mask cover face perfectli gap fit nose use mask work elementari public school teacher,5
noth dislik seen mask someon els knew get use second mask protect covid,5
qualiti,5
mask small face especi length,3
durabl,5
tough breath mean good seal allow breath mask instead gape hole good one,5
great mask comfort easi breath,5
fake n mask real one go around whole head,1
medic use viru protect n respir read inform purchas realli need say first end page use need sinc n respir still disappoint product,1
mask small,3
super fit,5
well made fold buy recommend other,5
mask great sturdi noth like cheap one big box store get hot wear prolong period would recommend anyon,5
advertis fast servic would use,5
odd shape small fit well seal cover area bridg nose bottom chin men one size fit work intend task,1
k mask seem excel qualiti mask go comfort fit well much fog glass definit plu arriv well packag would definit recommend purchas,5
work well,5
deliv promptli packag conveni reseal pack five like mask reus number time air definit order need,5
nice packag job well,5
purchas think black color make would show ye black outsid white insid,1
comfort,5
fit well across nose chin stay closer face side cloth mask hope would buy,5
big face fit great,5
mask ted fog glass badli come insid cold day warmer weather practic unus say kn protect bad design problem,3
like everyth,5
small big man mask shape like bird beak small well,1
think product pretti great love black fitt well head small side littl price fro budget,4
qualiti mask close fit comfort ear elast work well remain breathabl even worn surgic mask good buy doubl mask recommend cdc,5
fit well easili adjust could prevent glass fog,5
seem like good product,5
good,4
seem good qualiti product,5
work great comfort,5
advertis,5
sinc mask time doubl one home made kn order sever set hope carri us least summer,5
fit well stay place thick much better feel safer regular light blue dispos mask,5
bought mask husband travel intern wear mask better part hour said comfort wore meet trip home comfort keep safe travel half way around world return safe famili highli recommend,5
excelent materi muy resistent en perfecto empaqu lo recomiendo,5
great mask good price great qualiti comfort,5
work well except ear section fit loos around ear would purchas,5
like fit mask comfort wear feel thick mask good protect,5
mask gave breath room yet secur need like thick,5
work good safe,5
comfort great,5
comfort face,4
done extens research kn mask purchas fda health canada inspect import ppe devic sinc recal notic product feb fit comfort good cost competit current import covid mask although arenot niosh osha approv meet criteria set u fda health canada eua,5
one best,5
great qualiti pass water test keep famili safe,5
filter hairspray mask fit plu size think true n let smell aerosol seep minim protect,2
fit perfect,5
like wear alon doubl mask,5
mask comfort look ridicul wear creas middl make look like beak,3
order product sister paid extrem pleas product,5
excel fit gap,5
mask fit nice larger face wife smaller face us wear glass vertic fold style fit nose pinch built metal nosepiec reduc fog better anyth els tri wear three layer washabl gildan cloth mask bought back summer fit save us tri jam cloth mask glass eye get secur washabl cloth mask protect mask much exposur hang command hook let germ die rotat week help number forget one worn like fuse mask stitch lighter spot synthet filter layer heat fuse togeth wider fuse base give strap seem make much secur mask dispos use seem legit packag batch number come stamp slip show chengd mask test much harder smell thing wear one even breath problem go say least adequ filtrat,5
got guidanc came doubl mask great thick sturdi ear loop comfi nose wire adjust troubl cloth mask fairli price pleas cours thick get hot sweati insid think mean work,5
happi mask provid good fit seal look high qualiti well packag good number mask,5
mask fit snug face gap feel provid adequ protect,5
essenti worker high risk must chat custom wear mask day mask seem suit need finger cross work,5
mask littl small facethey fit workersgreat price,4
fit well face,5
stay away nose mouth breath,5
work wear day educ,5
mask well design comfort breathabl environ requir mask time far mask made easier get mask fatigu irrit face,4
use go gym,5
mask trick comfi wear day,5
like white one order better metal nose piec,4
like fit littl better layer step fabric pli surgic mask,5
definit thicker kn bought feel like better protect would like adjust ear loop make littl tie one mask need feel tighter defend recommend mask,5
work well,5
promis,5
good qualiti fit great,5
suitabl protect,5
bought kn black white thought black would look better fit well elast band tight ear comfort initi smell suspect due black dye found take set plastic bag come seal group plu day air smell goe away give star would buy,4
product came day great,5
mask work great wife guess proport head put mask bare fit suppos one size fit work work great wife,4
nice fit,5
mask best sinc start wear year ago other surgic homemad other stuck mouth talk slip nose small face mani mask seal well kn mask snug fit yet comfort thick come beek like point thu keep mask lip wear long period time adjust strap aid face nose feel protect slight feel humid within mask exert talk lot bother significantli enough believ make tight safe fit,5
like cover face problem,5
like work well,5
kn mask certifi us nation institut occup safeti health inferior n mask kn mask certifi via chines standard also filter captur micron particl differ filter layer n respir fold thicker fold higher dipol charg densiti kn respir studi publish decemb found,1
still covid free year coupl month,5
perfect fit,5
ye,5
comfort right thick,5
breathabl like plenti mask hope would fog glass,3
good facial fit pucker,5
mask great project allow easier breath actual wear mask cloth mask groceri store still breath feel safer,5
husband like mask usual mask fit one us like comfort better rate,5
excel mask glass fog comfort wear,5
disappoint purchas bought specif pictur show nose band insid mask outsid guess got,1
mask much comfort cdc approv authent protect wear day comfort whole time,5
fit small,3
mask comfort nice fit cannot get stay face stay chin way nose soon open mouth mask slide face expos nose second talk slid complet press neck way get protect never open mouth mask doubl mask tight fit cloth surgic mask hold place,1
wonder,5
like mask comfort good quantiti,5
face cover,5
qualiti look fit mask great,5
comfort stretch thicc good would definit buy,5
great use doubl mask,5
like five layer howev ear loop stretch quit bit fix issu tie knot end problem solv,5
great fit thicker normal mask,5
comfort stretch thick,5
love mask buy everi time travel,5
best one,5
first mask one doubl protect,4
heard n mask better protect corona viru,5
hard time breat,1
describ,5
strap tight enough get good seal invalid point n kn mask use adjust strap tighten cloth mask make ear loop x tight make better seal,1
