x,y
mask larg enough comfort big head elast strap much nicer one dispos paper mask soft wide cut ear,5
use air travel intern travel,4
great item fit tight face buy,5
comfort secur mask black,5
like thick comfort wear mask,5
like comfort thick mask,5
great protect great price,5
like mask sit nose mouth even put second fabric mask top feel confin comfort mani dispos fabric mask go,5
nice kn mask like tradit white color must time,5
miss lead use descript covid protect,1
get spam whatev caus mask made adult fals advertis mask cover like authent mask materi feel look cheap etc come protect gear buy product made china caus get paid,1
breathabl,5
like mask find easi put wear yet elast tight husband,4
love gap side,5
comfort breathabl secur,5
fit well comfort,5
great mask comfort,5
feel like bigger kn mask snug around chin area,3
mine fit great husband fit littl small,5
excel comfort,5
item comfort,5
great mask gave star comfort chemic smell first put go away wear best breath,4
easier breath,5
use time pain bum wear glass job,4
need mask one,5
seem good qualiti first order,5
great fit,5
wear lipstick mask smear stand away mouth although meant wash pleasantli surpris held water tell littl permeat,5
comfort seal face also like adjust nose piec,5
love safe comfort,5
metal nose piec extrem weak therefor conform nose purchas much better kn mask actual promis,1
like maskscomfort,5
fit pretti well face,5
coverag mouth nose,5
great thick mask,5
great product comfort stretch perfect thick make feel safe purchas numer time,5
nice mask wish black insid make,5
terribl smell insid,3
comfi keep safe,5
part combat coronaviru use everi day,5
better good deal price qualiti,5
comfort,4
kn mask way go accept,5
fairli comfort ride nose jam skin adjust allot,4
purchas mask wear flight last month comfort problem airlin plenti room around nose odor like one use past,4
love comfort thick mask,5
daili coronaviru interact,5
mask incred comfort wear,5
small leav indent cheek hard breath stiff cardboard like materi swear knock someth threw away,1
especi like mask fit rather larg head without tight ear result kn mask,5
price right work great,5
tri lot fit perfect breath talk,5
comfort wear wear one,5
mask need,5
real kn fit tight around face air pocket black non medic dispos mask provid protect pink color cute though,1
comfort fit wear long workday,5
great mask,5
great fit light almost know,5
great advertis would order without doubt,5
great mask protect,5
blow test light test seem thick happi,5
mask fit tightli around nose mouth sometim hard breath work well,5
like mask howev surpris disappoint mask individu wrap pack open expos even though insid apart,3
buen producto de calidad para estar protegido del viru,5
unabl wash,3
feel confid safeti mask comfort uncompromis breathabl,5
feel mask fit better blue surgic one unfortun hot,5
mask comfort mask tri,4
mask purpl,1
good mask price breathabl,5
perfect fit comfort,5
daili wear mask fit adult fine fit larger children ok tie loop elast extrem durabl famili coach play basebal,5
sever face mask wear comfort mind keep hour time fashion comfort import,5
breath much easier protect friend ask bought shee went onlineeasi use protect friend bought saw use recommend highlt,5
use face mask commut citi great peac mind breath germ smog pollut nyc,5
great seal glass wearer even adjust nose bridg,3
favorit mask thick sturdi built away nose face rub chafe tickl easi breath fold store pocket wrinkl reworn mani time toss look good,5
realli comfort mask protect make ear hurt,5
extrem warm wear day,4
es muy buen materi,5
use kn n white look bad public social color make someon look sick intimid hunt black mask readi give n protect mask perfect fiber come itch nose addit comfi put highli recommend mask also mention one best kn mask tech articl,5
comfort,5
good mask fit snugli,5
comfort fit tightli face may littl uncomfort ear tight fit stretch larger face seem good thick filter particl,5
love mask allow breath fit small face hit eye lash,5
thick breath,1
nice,5
breathabl,5
sinc mask forese futur give comfort confid need also water proof,5
awesom,5
good buy,5
face mask protect enough caus skin break,1
use one alreadi would return,1
comfort light weight stretch,5
satisfi,5
attempt surviv plagu far good,5
way tight elast goe around ear tight assum mask tight mask dig face leav line long time,4
comfi light,5
made peopl eye want see mask eye dont buy,1
fit well around face stretch nice around ear light weight,5
bought product valu normal buy style mask yet pk greater valu great mask,5
comfort stretch strap far break fall,5
larg face,3
love wear pink n mask work,5
comfort adjust nose bridg secur fit rel easi breath model good valu,5
mask good materi qualiti,5
feel much better last brand elast strap much durabl last brand tri,5
like mask fit well,5
thin,1
work well hour wear becom hard stay behind ear snap back great short period time,4
work well wear glass elast strap fit fine mask fit well cheek chin area purchas,5
comfort,5
best fit compar mask,5
mask stay place without droop,5
order husband complaint,5
construct n standard import due point cone nose mask creat small chamber littl easier breath flat surgic mask fit bit better old n mask two elast strap ran left right mask two strap loop side make put take much easier n mask fit snug may distort use therefor recommend replac mask use,5
comfort mask use fit even husband comfort,5
like,5
excel product,5
gustaron son c modo,5
feel safe secur behind mask fit well without tight around face fulli close gap nose bridg secur,4
esta mascara pareciera q hiciera totalment lo contrario protegerm anterior esta mascara tenia otra n se empanaban mi lent con esta puedo ver q al interior tien mucho hoyo q dejan expuesto todo igual manera siento q funciona,2
love mask,5
work describ good qualiti,5
strap pull without much effort,3
open one pack took one mask immedi felt sharp itchi pain similar get close cactu garden look hand see least thin sharp fiber stick hand remov tweezer hand realli itchi even wash hand disappoint get vaccin hope visit famili anoth state want kn mask travel buyer bewar,2
run small still fog glass,4
work well,5
comfort breathabl,5
work educ wear mask entir time work comfort glass fog,5
tailor made mani mask nice mask underth other,5
wear gym two pli cloth mask silicon mask bracket fit insid perfectli great fit comfort,5
noth,5
must teacher sit away mouth talk without suck fabric use cloth mask would short breath lectur mask solv problem highli recommend,5
best ppe mask use great fit kn protect black dark kn letter clean look,5
prefer mask stick face u take deep breath pretti comfi thing string alway hurt ear matter,5
love fit well pull ear breath space much comfort mask use,5
secur fit ad protect littl tight howev,5
comfort good seal,5
littl small work good friend custom servic compani wonder though went way make sure happi order,4
mask easili put slide right idea dispos mask readi hand need ideal situat need worri germ breathabl mask readi work,5
great face mask comfort good fit,5
mask feel less intrus good fit less fog glass wear highli rate protect lot thing includ allergen,5
mask snug fit sinc kinda stand nose easi adjust also less problem glass fog mask better job seal nose area worn work hour start feel bit uncomfort around nose cheek problem breath though fulli vaccin tend use lighter blue mask work still like mask groceri store anyth last less hour,4
mask realli cover well stay place famili hard time adjust breath wear tho especi sinc lung collaps layer may much bought base review still worth tri given use,4
headlin say btw alaska brother california recommend guy good stuff news cross state line keep tx,5
terrif mask made feel lot safer public,5
love mask,5
great mask price,5
great comfort lightweight mask would busi seller,5
black color perfect auto busi wear meet custom white one get dirti day although worn hour total day,5
wife love ear elast tight larger head keep pull rate base wife opinion,3
say best ever tri k n best far,5
product arriv perfect condit exactli describ show pictur tri mani kn past materi good seem durabl howev comparison mask found one big elast fit fine matter length big air leak nose bridg use glass got foggi time tri adjust metal bar mani time without succeed reason got back origin set minut definit good mask face nose type use situat face lot peopl avoid risk,3
mask tight male adult face,3
comfort,5
product advertis small face like feel look,4
best mask found order spent lot money mask alway disappoint order feel safer comfort mask other,5
mask make feel safe,5
comfort fit,5
room mask breath seal around nose glass fog badli,5
breathabl mask,5
realli like product order soon,5
like particular face mask fit snugli pull ear,5
like classi black color,4
mask comfort wear nice altern full n fold nice put jean pocket visit client look profession order,5
meh,3
fit absolut perfect,5
made china,1
well made advertis,5
mask,5
disappoint purchas ear loop break easili comfort wear good valu,2
interest mask advertis pli mask seen order total impress thick yet light weight mask mean wear mask time save money save live,4
heavi item earloop fine fit fine mask heavi bridg nose hard wear hour time take gave headach,3
fit nice,5
receiv piec instead advertis,1
good,5
great product highli recommend public set,5
bought thick safe one buy,5
kf korean manufactur industri standard similar n manufactur standard us use compani manufactur air filter respir like honeywel unfortun chines manufactur start slap k front n make confus consum whether mask manufactur korea fool unscrupul chines compani standard,1
fit well nose kept slip end throw rear away tri coupl,3
ninguno,5
good qualiti great fit comfort wear long period time,5
good comfort product fit well,5
great,5
ear loop littl irrit overal good well fit mask,4
great face mask like style color comfort around face area howev comfort opinion find wear one get use bother much,5
great mask,5
air mask packag wear chemic smell,5
small head pull hard ear hurt brand longer ear loop,4
much comfort other tri,5
fit well unpleas odor,5
lightweight comfort easi put breathabl,5
good fit would buy,5
use product automot covid use work great,5
work hospit use kn mask daili sinc covid start comfort continu wear switch n mask behind head band go covid posit patient room purchas mask bag wrap mask per packag,5
purchas keep car c er nurs mani year experi wear mask like sit face except locat need proper fit mask comfort thick feel like give adequ protect like elast band ear larg face wear small n mask hospit band tight bother ear extend wear would abl toler hour end pinch great substitut comfort mask,4
good fit,5
mask bignot made petit small face,3
great purchas stay safe protect make make breath easier black match everyth wear,5
great mask price,5
great item describ thank,5
good fit comfort sturdi reusabl,5
comfort,5
perfect complaint,5
origin purchas bc wear black mask work tight adjust also stiff sharp around face keep last resort,2
far issu,5
qualiti good mask big,2
like n strap around ear like overal fit big even husband return,2
like glass get foggi tight cheek bother otherwis would given five star,4
quick deliveri work well lot room,5
great put one work comfort forgot,5
time,5
good product,5
easi wear,5
fit good problem breath problem mask,5
imho satisfactori qualiti gener protect medic use,4
great product thx,5
realli like color fit n mask larg mani gap feel mask better fit make feel safer pink color give littl fashion,5
perfect fix light weight,5
job,5
bought hubbi primarili use easi breath fog glass buy,5
far good long strap break,5
littl bit tight bad long wear extend period time,5
product advertis quick ship good valu,5
perfect want,5
fairli comfort fit face also disappoint seem like everi face mask sold amazon made china buy mask elsewher,3
mask great highli recommend elast stay fit great best part stay away mouth get,5
tight rub nose,1
smaller mask daughter rt like better one give hospit order give thicker,5
opinion mask go comfort one fit excel preclud breath overli satisfi would recommend great kn option,5
almost perfect fit glass wearer best mask found far minim glass fog fit comfort snug feel protect,5
okay far mask stink cannot even wear one soak wash aw smell,3
fit good thin wire help avoid eyeglass fog,5
love share,5
comfort great fit,5
feel protect wear mask mask larg face one fit better also keep shape thicker normal dispos mask imagin wear cloth blue dispos mask use kind feel like would need wear sever cloth one order get even close protect,5
excelent,5
comfort secur fit,5
self,5
good fit big head fog glass,5
comfort fit well seem well made,5
fit nice glass fog adjust properli howev ear strap must short ear start hurt unfortun adjust wear unless short period time,3
bought wear airlin trip take soon need lay face give enough room breath work great,4
pleas mask fit well look fine seem authent find piec paper bag,5
great fit good price definit buy,5
order extra larg mask well cover fit end nose tip chin mask extra larg small must fit newborn babi amazon custom sinc suppos care order gotten big,1
receiv product immedi open packag use one disappoint twist string twice around ear order keep mask place kn mask strap right proport fit perfectli guess mask design bigger person twist string around happi read review indic mask perfect obvious head face bigger mine averag size head happi like product,2
good qualiti nice use,5
realli like mask stay lift face,5
kn mask comfort wear long period time cover complet nose mouth move talk also offer multipl layer protect,5
great follow comfi well,5
good materi filter particl easili conform face wrestl thing minut tri kind way get seal around face wast time appar wast money normal would give someth use friend famili want get sick respir conform facial contour lot research purchas someth expect disappoint look elsewher,3
stay around ear,3
mask perfect except smell weird chemic rubber smell otherwis good,4
fit well allow better breath,5
mask good breathabl therefor filter well signific amount air enter exit nose bridg matter tight make good kn n easi breath without resist filtrat forc air enter exit around edg,3
mask arriv promptli well packag authent certif enclos prefer wear black rather white littl less medic insid line white howev still get makeup stain,5
buen en todo lo sentido,5
love,5
good price fit nice buy even tho look like bird beak still great qualiti great price,5
love,5
final mask fit well give headach wear day good buy,5
good product previou order powecom believ better overal,4
great fit mask comfort,5
constrict airflow,3
go public,5
like soft feel comfort unfortun need chang least daili mani packet expens keep order,4
product right felt good know better mask product versu cheap one,5
ear strap short face fit small husband,4
excel mask breath easili rub lipgloss feel protect,5
second time purchas mask rate pretti good far filtrat goe plan wear mask long time asthma want complic,5
great,5
lightweight littl bit tight far comfort ear realli want loos loosen first coupl use slightli come talk readjust way better flimsi blue one materi thick remov breath well made use,5
wore mask plane ride pretti comfort good seal feel like suffoc,5
mask absolut aw idk shape face everi time breath air nostril shoot extrem hard inner corner eye creat tickl dri sensat tweak nose ridg posit mask sort way thing happen everi time idea mask mani star review,1
best fit mask found like metal wire thicker other provid closer fit nose result stop fog glass,5
good product kn order begin pandem came china via aliexpress much better one wanna buy goe head make sure glue fall apart recommend,3
comfort easi breath,5
realli tight,4
like comfort,5
great qualiti fit perfect face,5
comfi safe littl big face bother,5
without ruin lipstick comfort without muffl speech like mask,5
good,5
fit hubbi perfectli airtight seal around face fog eyeglass comfort fit unlik mani kn tri amazon seem alway tight averag size huge head multipl chin fat face averag guy still tough tri fo mask fit fit well appear well made proper certif glad still avail,5
like,5
great,5
big enough face wife face,1
fit like glove,5
son return school hybrid model came handi comfort job keep safe,5
comfort fold nice pleas,5
easi use,5
asthmat make mask use tough like mask short period wear light weight stay put face,5
comfort n fit,4
great product wash loos qualiti comfort effici,5
easi breath talk wear,5
mask fit well stay place stay away mouth easier talk wear mask,4
fit well breathabl mask,5
nice mask good coverag feel secur easi breath wear durabl stretch shape come high enough nose slide topmost point glass thu significantli reduc fog glass len also like black color purchas soft comfort insid would recommend,5
great mask protect black goe everyth,5
effect comfort,5
mask fit small face well arriv earli expect,4
love kind mask fit realli well comfort expect wear mask day work,5
comfort constrict,5
comfort great,5
kn face mask comfort easi wear,5
wear month work overal fit well great seal absolut vital air mask wear want throw pack away,5
mask wide enough,3
comfort,5
love breathablil mask nice qualiti dispos mask last long time could handwash comfort mask purchas love individu wrap,5
sell cheat custom product receiv differ display even packag,1
big face petit femal surgic mask underneath seal improv feel safe,4
mask look good terribl smell never goe away would recommend,1
easi breath threw use blue cotton pli one much thicker,5
make easier breath glass howev elast tight behind ear short,3
loos mask nose clip work,1
felt like suffoc,1
n,5
tight fit,5
right size love black nice chang white mask,5
insid white layer becom fri make uncomfor wear mask buy,2
product qualiti merchandis mask last day first use inner part mask start get fuzzi irrit start like get mouth realli nasti,1
great protect comfort,5
way small larg xl size face amazon terribl provid size inform kn mask idea get buy tri late,1
like fit mask,5
arriv quickli love individu wrap,5
perfect woman smaller face ignor review complain child size tri child size mask small peopl buy mask seem made men women larger face nice find mask actual fit pink realli cute give femal friend love well,5
n mask work great husband although big face smaller person prefer wear cloth face mask softer,5
super sturdi tight yet comfort fit complaint self inflict poke eye pull mask back lower eat,5
look littl beaki also day caught covid wear one bulletproof solut,3
travel state comfort lightweight,5
n,5
well made mask seal pretti good around nose mouth talk stay place wear minut ear start hurt left red mark cheek would perfect kid someon thin small face us good wear minut comfort longer period time,4
deliv fast fit face better pleat light blue mask wear,5
problem suppos black,5
amazon hub work properli door click open system regist packag sever door open offic bellavista hilltop richmond ca report sever time extrem dissatisfi,1
mask comfort gave sever peopl,5
comfort fit nice,5
perfect,5
face mask comfort lightweight good stretch snug fit make feel well protect,5
work well wish came differ size,4
kn face mask,5
realli comfort light,5
protect need,5
fast ship everyth expect thx,5
mask describ arriv time reason comfort hard ear overal satisfi,5
protegen bien apretan en la cara,5
comfort mask fit great good valu money,5
actual breath mask fit snug cheek chin seam done bridg nose keep mask collaps talk,5
like mask put split chin cheapli made worth money paid entir bag thing split soon short time would recommend mass anyon safe,1
comfort well made,5
well made look nice fit well complet seal mask would buy,4
perfect execut great product,5
elast tend break mask,3
pull one use first time today ear strap stretchi like fit cleanli crevic ear head see imag stretchi hospit blue mask left equal weight appli differ would even greater also strap flat instead round blue mask left mean fit care feel comfort,4
realli like mask fit husband well differ size shape face,5
great fit comfort durabl,5
like,5
want kn mask pink saw anoth woman show purchas order doubl product wore first time today love color mask white comfort fast ship happi,5
work great,4
like mask lot fit well w gap nice secur fit,5
use yet look pretti comfort feel comfort order trip take plane seem littl bit appropri standard surgic mask,4
mow lawn,5
mask great littl hot felt like get great filtrat,5
fit good breath better cloth mask,5
excel choic covid protect wiith group peopl one wear mask got covid,5
comfort one tri far,5
small adult,1
rd pack far comfort stay well glad past month,5
excel product breath,5
fit face perfectli minim fog glass thing would chang adjust strap hurt back ear,5
light comfort like go head rather ear still wear three layer surgic mask keep clean,4
love mask fit perfect face love touch nose protect,5
previou flight wore regular mask time arriv destin two hour ci could bare keep thing next flight purchas pack happi report allow better breath longer time highli recommend elast fit comfort behind ear beard tend slip bit noth major,5
like mask ok seem work well need wear,5
elast short pull uncomfort,3
comfort,5
love,5
well made good fit,5
use requir enter store etc promot good health practic,5
black mask better fit white one,4
great wear day comfort,5
good product,5
great mask materi move breath hot either,5
super comfi room breath lightweight also creat close connect ruin face,5
skeptic concern review mention smell use review advantag upon receipt open mask let air never concern smell fit face well felt comfort pandem wear mask,5
great product protect face realli well especi covid god bless,5
product describ arriv promis pleas,5
felt safe like comfort,5
use week simpl truth fit suffici well kn n mask mask tend slide around actual kn n mask slide eye needless say far ideal given covid expos side risk touch eye random point day regard comfort end day work feel like ear get saw strap mask strap set way n kn experienc issu would also lead mask actual properli fit ala case instead go ear loop design god aw tl dr yet anoth chintzi product china stay away possibl,1
bought black mask mask individu wrap distinct chemic smell go away even air mask smell made nauseou would recommend buy black mask due,1
great qualiti fit fast ship recommend seller,5
enjoy color well feel safe,5
ear strap flimsi,4
look like mask cool feel insid seem heavier breathabl,3
work well,5
comfort wear howev insid mask chemic smell,2
protect public possibl catch covid also help pollen sinu,5
great buy,5
far good like littl shorter bridg big face anoth mask purchas last year anoth brand probabl good thing wear surgic type mask ad protect comfort breathabl also bought black,5
love could breath,5
love purchas nd time feel protect wear mask worn thought great pale comparison regret purchas,5
mask small difficulti breath mask receiv stretch,4
need cooler,4
need,5
fit well kn breath escap nose brim metal fit tight elast ear loop loos much better surgic mask,1
great fit great price product highli recommend other purchas,5
built much care precis white kn order white kn sharp edg made uncomfort wear also metal nose form strip would fall white version integr thing hot glu ear strap occasion fail easi fix lighter hot glue gun worth money good buy,5
muy buena c moda,5
mask except fit beauti kid smash face super comfort highli recommend,5
item ok price,4
absolut trust mask reorder mask got month ago paper thin comparison origin mask smell like chemic return,3
product smell aw could even keep face second much less plane ride,1
pretti tight yet comfort mask appear good qualiti,5
mask feel small adult edg cut face,2
work great,5
exactli describ,5
problem product,5
qualiti great say littl hard breath know thick wear go walk lot close space travel,4
work occas tad larger side,4
surpris comfort mask wear fit well one still breath easili nose band adjust right keep glass fog time,5
want everyon know true n mask true n mask loop around ear true n mask go around back head healthcar profession write review know differ,1
although well vaccin continu wear mask want use one daili use nose guard flexibl enough slip,3
nice comfort fit other saw gave site,5
good love,5
si gusto si lo uso todo lo dia gracia,5
excel qualiti,5
product self,5
excel product good qualiti,5
great purchas,4
mask less mold shape may work well child howev face way small keep leak around nose bottom section irrit chin rub whenev move jaw small person,2
good,5
old outdat,5
like shape confront weight would highli recommend purchas,5
space mask mouth lip rub lip,5
comfort,5
fit everyon hous,5
like fact mask fit next face gap,5
comfort wear offer great protect,5
excel,5
fit exactli expect second order,5
nice mask protect,5
fit good fog glass bad wear day work breath fine,5
great mask work great multipl day comfort durabl also,5
met expect great product price would definit would recommend product famili friend,5
estan muy comodo muy buena calidad,5
qualiti mask issu snug fit wider face made ride face irrit back ear,5
like assum kn weaver lol weaver legit legit quit buy like love wear mask time time work work work hard work hard anyplac need go know like want mask ask kn black got jack got back one trust good right could sleep night delight,5
everyth mask great,5
comfort easi breath,5
great fit easi breath wear,5
product came describ anoth similar mask purchas earli pandem wish found st high qualiti see layer protect good buy,5
cheap madedid fit face allwhen inhal could feel air escap,2
great highli recommend,5
fit well littl bit stiff soften use,4
fit well slip comfort safe,4
product stretch cover nose mouth comfort seal safe uncomfort worth money paid far tri one took rest still sit cabinet hous,1
love mask comfort easi breath wear,5
fit great ear loop littl extra give tie knot want make smaller prefer brand sell super tini ear loop hurt ear,5
mask comfort wear extend period good buy,5
look,5
good purchas price,5
